,0
535,"Việt_Nam đứng thứ 4 về số sinh_viên học cao_đẳng và cử_nhân ở Mỹ. Số_lượng sinh_viên Việt_Nam tại các trường đại_học , cao_đẳng Mỹ tăng 5,7% lên 21.900 sinh_viên trong năm_học 2022-2023 ."
536,"Khu đô_thị bán khép_kín xu_thế sống mới tại Hà_Nội. Khu đô_thị bán khép_kín đảm_bảo an_ninh , gần_gũi thiên_nhiên , hệ tiện_ích chỉn_chu mang lại cuộc_sống tiện_nghi cho cư_dân đang trở_thành một trong những xu_hướng sống mới được nhiều người_dân Hà_Nội lựa_chọn ."
537,"Trả lại 260 triệu đồng chuyển nhầm. Quảng_Ngãi Bất_ngờ nhận được 260 triệu đồng từ tài_khoản lạ , anh Võ_Văn_Thinh , 33 tuổi ở huyện Nghĩa_Hành đến công_an xã để tìm người trả lại ."
538,"Bộ Công_an đề_xuất 6 trường_hợp nổ_súng không cần cảnh_báo. Tại điều 25 của dự_thảo luật , Bộ Công_an đề_xuất người thi_hành nhiệm_vụ độc_lập phải cảnh_báo bằng hành_động , mệnh_lệnh lời_nói hoặc bắn chỉ_thiên trước khi nổ_súng ."
539,"Cháy tại siêu_thị Lotte ở Sài_Gòn. Khói_lửa bùng lên từ quán thức_ăn nhanh gần lối ra trung_tâm mua_sắm Lotte_Mart , quận 7 , nhiều khách hoảng_loạn tháo_chạy , tối 22/12 ."
540,"Thanh sắt hàng_rào 1,7 m đâm xuyên bụng lên ngực nam thanh_niên. Bệnh_nhân được đưa vào Bệnh_viện Trung_ương Quân_đội 108 cấp_cứu trong tình_trạng thanh sắt 1,7 m đâm xuyên từ hạ sườn phải lên ngực trái ."
541,"Alcaraz bị loại bởi tay_vợt hạng 45 ATP. Roman_Safiullin khiến hành_trình của hạt_giống số 2 Carlos_Alcaraz tại Paris_Masters kết_thúc chóng_vánh ngay sau trận đầu_tiên , Tay_vợt hạng 45 ATP thắng 6-3 , 6-4 tại vòng 2 và giành vé đi tiếp ."
542,"Lệ_Quyên khoe sắc vóc gợi_cảm. Bên cạnh hình_ảnh sang_trọng và quý_phái , Lệ_Quyên cũng có những phút_giây thăng_hoa , nhiệt_tình quẩy cùng bạn_bè ."
543,"Á_hậu Ngọc_Hằng dạy tiếng Việt cho thí_sinh Miss_Intercontinental 2023. Trong những ngày tham_gia cuộc thi Miss_Intercontinental 2023 ( Hoa_hậu Liên lục_địa ) , Á_hậu Ngọc_Hằng luôn thể_hiện sự_thân thiện , hoạt_bát và nhiệt_tình giao_lưu với các thí_sinh quốc_tế ."
544,"Trường đại_học thưởng Tết cả trăm triệu đồng , có không ,. Thưởng_Tết của giáo_viên , giảng_viên là câu_chuyện đến hẹn lại được bàn_tán rôm_rả ."
545,Thuỳ_Tiên chụp ảnh thời_trang thông_điệp sống chậm. Thuỳ_Tiên - người đẹp tranh giải Mỹ_nhân của năm tại Ngôi_sao của năm 2023 - tung bộ ảnh lấy cảm_hứng về sống chậm .
546,"Bệnh_nhân có bảo_hiểm_y_tế nhưng được hướng_dẫn ra ngoài mua thuốc. Nữ đại_biểu HĐND tỉnh Hải_Dương cho biết , hiện_nay vẫn còn tình_trạng nhiều bệnh_nhân mặc_dù có bảo_hiểm_y_tế nhưng khi đến bệnh_viện khám , điều_trị lại được hướng_dẫn ra ngoài mua thuốc ."
547,"Khốn_khổ vì bị lôi vào các hội , nhóm lừa_đảo. Không_chỉ bị khủng_bố với cuộc_gọi rác , tin nhắn rác , công_nghệ ngày_càng phát_triển trên điện_thoại thông_minh khiến nhiều người dùng dù cảnh_giác cách mấy cũng rơi vào bẫy của những kẻ lừa_đảo ."
548,"Thủ_tướng ra tối_hậu_thư đưa 3 tuyến cao_tốc về đích trong năm nay. 3 dự_án đường_bộ cao_tốc với tổng chiều dài 70km gồm cầu Mỹ_Thuận 2 , Mỹ_Thuận - Cần_Thơ , Tuyên_Quang - Phú_Thọ , được Thủ_tướng Phạm_Minh_Chính yêu_cầu hoàn_thành trong năm 2023 ."
549,"Cầu_thủ CLB Khánh_Hoà đình_công chờ được giải_ngân tiền_lương. Một thông_tin không vui cho bóng_đá Khánh_Hoà khi hôm_nay ( 7.12 ) , các cầu_thủ của đội bóng phố biển quyết_định đình_công vì bị nợ tiền_lương , tiền lót_tay và thậm_chí bảo_hiểm_xã_hội của đội đến nay vẫn chưa đóng ."
550,"Chương_trình tư_vấn sức_khoẻ. Chào bác_sĩ , bác_sĩ cho em hỏi những việc không được làm khi thực_hiện sơ_cứu cho người bị bỏng là gì ,"
551,"Liêm_chính nghiên_cứu khoa_học Nhiều quan_niệm cần được giải ảo. Theo các nhà_khoa_học , để xác_lập được nền_tảng liêm_chính khoa_học thì trước_hết cần giải ảo một_số quan_niệm trong đánh_giá sản_phẩm khoa_học , nhà_khoa_học ."
552,"Trường đếm like cộng điểm gây tranh_cãi , hiệu_trưởng lý_giải. Phần chấm điểm cho bài thu_hoạch ngoại_khoá của học_sinh một trường_học tại TPHCM tính cả lượt tương_tác trên Facebook , Zalo , Điều này đang gây ra những tranh_luận gay_gắt ."
553,"3 ngày trước Tuần_lễ cảm_ơn , UNIQLO bật_mí loạt ưu_đãi hấp_dẫn. Dịp cuối năm , UNIQLO mang đến nhiều quà tặng và ưu_đãi nhân_dịp Tuần_lễ cảm_ơn để tri_ân khách_hàng Việt đã tin_tưởng và ủng_hộ trong thời_gian qua ."
554,"Nữ_sinh tát bạn , đòi đuổi giảng_viên Khi em nói , cô nên cúi mặt xuống. Trong buổi làm_việc giữa các bên sau sự_việc đánh_bạn , đòi đuổi giảng_viên ra khỏi lớp , nữ_sinh C.V. , Trường Đại_học Hoa_Sen yêu_cầu khi mình nói , giảng_viên nên .. , cúi mặt xuống ."
555,"TPHCM Hàng_loạt người vào viện vì mọc nhiều thịt dư , sợ ung_thư. Thấy ở cổ , nách và mặt ngày_càng nổi nhiều nốt lạ như thịt dư , người phụ_nữ lo_sợ bị ung_thư da khiến tinh_thần căng_thẳng , phải vào bệnh_viện cầu_cứu bác_sĩ ."
556,"Tiết_lộ bất_ngờ về cô gái trong vụ ngoại_tình khiến Bill_Gates bị tống_tiền. Tỷ_phú Bill_Gates gặp cô gái Nga tên là Mila_Antonova vào_khoảng năm 2010 , khi cô ở độ tuổi 20 ."
557,"Giá vé máy_bay Tết đắt_đỏ , người_dân đau_đầu tìm đường về quê. Như mọi năm , giá vé máy_bay Tết năm nay vẫn ở mức rất cao , Nhiều người lao_động đang phải loay_hoay tìm cách về quê sao cho tiết_kiệm nhất ."
558,"Nhà_máy xử_lý rác_thải lớn ở Thái_Nguyên được cấp phép môi_trường. Dự_án đầu_tư mở_rộng Nhà_máy xử_lý rác_thải ở thành_phố Phổ_Yên , Thái_Nguyên của Công_ty cổ_phần Môi_trường Việt_Xuân_Mới vừa được cấp phép môi_trường ."
559,"Bệnh lây qua đường hô_hấp tăng ở nhiều nước , Bộ Y_tế lưu_ý cách phòng_bệnh. Số ca mắc bệnh hô_hấp , cúm A ( H 5 N 1 ) , Covid-19 gia_tăng tại một_số quốc_gia , Nước ta hiện trong giai_đoạn mùa đông_xuân , đây là điều_kiện thuận_lợi làm bùng_phát các dịch_bệnh truyền_nhiễm ."
560,"Tai_nạn phòng_the có_thể khiến chị_em nguy_hiểm tính_mạng. Ở phụ_nữ , thượng mã phong có_thể xảy ra khi họ quá hưng_phấn , nhưng sức_khoẻ yếu hoặc tâm_trạng không ổn_định , gây quá_tải cho cơ_thể ."
561,"Tấn_Đức_Central_Park theo hướng đô_thị xanh. Thái_Nguyên Tổ_hợp công_viên hồ trung_tâm hơn 2,5 ha cùng tiện_ích hiện_đại tại Tấn_Đức_Central_Park được kỳ_vọng là môi_trường sống toàn_diện cho cư_dân ."
562,"Miền Bắc rét đậm , miền Nam mát_mẻ dịp Giáng_sinh. Ngày 24-25/12 , miền Bắc và Bắc_Trung_Bộ tiếp_tục rét đậm , rét hại , nhiệt_độ trung_bình ngày quanh ngưỡng 15 độ C ; Nam_Trung_Bộ , Tây_Nguyên và Nam_Bộ mát_mẻ ."
563,"Hơn 100 con giòi làm tổ trong mũi người đàn_ông. Lào_Cai Người đàn_ông 53 tuổi chảy_máu mũi không cầm , bác_sĩ phát_hiện nhiều con giòi làm tổ bên trong , các mô mũi bị ăn_mòn , viêm loét nghiêm_trọng ."
564,"Thiếu mặt_bằng , dự_án cao_tốc Vạn_Ninh - Cam_Lộ nguy_cơ chậm tiến_độ. Quảng_Trị Tháng 10 , tỉnh Quảng_Trị phải bàn_giao mặt_bằng sạch cho chủ đầu_tư dự_án cao_tốc Vạn_Ninh - Cam_Lộ , nhưng đến nay mới giao được 71% ."
565,Thủ_tướng Lọc hoá_dầu Nghi_Sơn cắt lỗ càng sớm càng tốt. Thủ_tướng đề_nghị Idemitsu và các đối_tác tiếp_tục tái cấu_trúc dự_án Lọc hoá_dầu Nghi_Sơn để cắt lỗ càng sớm càng tốt .
566,Điểm mua Gạo ST25 thương_hiệu Gạo_Ông_Cua - Gạo_Ngon_Nhất Thế_Giới 2023. Gạo ST25 ( thương_hiệu Gạo_Ông_Cua của DNTN Hồ_Quang Trí tại Sóc_Trăng ) của nhóm kỹ_sư Hồ_Quang Cua lai_tạo tiếp_tục đạt giải nhất ( lần thứ hai ) năm 2023 trong cuộc thi Gạo_Ngon Thế_Giới vừa_rồi ( Lần thứ nhất vào năm 2019 ) .
567,Vin_Diesel bị kiện quấy_rối tình_dục trợ_lý cũ. Jonasson - trợ_lý cũ của Vin_Diesel đệ đơn kiện nam diễn_viên và công_ty của anh vì hành_vi quấy_rối tình_dục cùng các cáo_buộc khác liên_quan đến môi_trường làm_việc thiếu công_bằng và sa_thải sai_trái .
568,"Học đi_đôi với hành Đi thực_tế liên_tục như sinh_viên RMIT. Tiến_sĩ Matt_Kim , Giảng_viên ngành quản_trị du_lịch và khách_sạn , ĐH RMIT , nói nhà_trường đang trong quá_trình chuyển_đổi từ hình_thức giảng_dạy truyền_thống sang học_tập đa hình_thức mà các buổi tham_quan thực_tế như đến lớp_học nấu_ăn , khách_sạn hay địa_điểm tổ_chức sự_kiện , trải_nghiệm du_lịch đường_sông , là một phần trong đó ."
569,"Giá vàng tăng phi_mã , có hút tiền từ tiết_kiệm ,. Giá vàng tăng phi_mã lên mức chưa từng có , trên 77 triệu đồng / lượng , Nhiều câu hỏi được đặt ra xung_quanh cơn lốc tăng_giá chưa có dấu_hiệu dừng lại hiện_nay ."
570,"Đại_biểu TPHCM Đo nồng_độ cồn cả ngày có lợi hay gây xáo_trộn người_dân ,. Đại_biểu HĐND TPHCM cho biết còn một_số ý_kiến lo_ngại trước phương_pháp giám_sát nồng_độ cồn cả ngày lẫn đêm , Vị đại_biểu này đặt câu hỏi , phương_pháp này có làm xáo_trộn hoạt_động của người_dân ."
571,"Di_cư từ Hà_Nội vào Nam thụ_tinh ống_nghiệm thành_công. Sau ba lần sẩy_thai , vợ_chồng chị Hương ( 28 tuổi ) chuyển từ ngoại_thành Hà_Nội vào miền Nam điều_trị vô_sinh và có con nhờ thụ_tinh ống_nghiệm ."
572,"Trương_Minh_Quốc_Thái Không thích dạng vai quá đơn_giản và dễ đoán. Sau nhiều năm đóng phim , Trương_Minh_Quốc_Thái thường mong_muốn những vai diễn có chiều sâu , tâm_lý phức_tạp để thử_thách chính mình ."
573,"Ung_thư xương giai_đoạn cuối sống được bao_lâu ,. Ung_thư xương giai_đoạn cuối có tỷ_lệ sống thêm 5 năm và giảm dần khi diễn_tiến qua các giai_đoạn ."
574,"Chứng_khoán giao_dịch ảm_đạm. Nhà_đầu_tư chọn đứng ngoài quan_sát khiến thanh khoản và biến_động giá cổ_phiếu đều ở mức thấp , VN-Index giảm hơn 4 điểm ."
575,"Mong con đi khám hiếm_muộn , phát_hiện nguyên_nhân do chưa dậy_thì. Anh N.T.L ( 31 tuổi , ở Long_An ) mong_chờ con gần 3 năm qua , anh thử nhiều phương_pháp từ tây_y đến đông_y nhưng vẫn chưa có kết_quả , Trong lần khám gần đây , bác_sĩ nghi_ngờ anh L , có biểu_hiện chưa dậy_thì ."
576,"Những động_vật sẵn_sàng ăn thịt đồng_loại. Hành_vi ăn thịt đồng_loại xảy ra ở nhiều loài động_vật như hổ , cá_mập , cá_sấu , , dù khá hiếm gặp hoặc chỉ trong tình_huống đặc_biệt ."
577,Các quốc_gia đang chờ Việt_Nam vào_cuộc chơi bán_dẫn toàn_cầu. GS Albert_Pisano đến từ Mỹ cho rằng các quốc_gia đang chờ và hy_vọng Việt_Nam tham_gia cuộc_chơi của ngành bán_dẫn toàn_cầu khi chứng_kiến những bước_đi đầu_tiên đúng hướng .
578,"Đâm sau lưng trong tiếng Anh nói thế_nào. Người Việt thường dùng từ đâm sau lưng để chỉ ai đó chơi_xấu mình , trong tiếng Anh , cụm_từ này được nói thế_nào ,"
579,"Trao giải cuộc thi DigiTrans_Smart_City năm 2023. Nằm trong khuôn_khổ Techfest-Whise 2023 , vòng chung_kết cuộc thi DigiTrans_Smart_City - Sáng_kiến xây_dựng thành_phố thông_minh năm 2023 với chủ_đề Ứng_dụng chuyển_đổi số trong thành_phố thông_minh đã lựa_chọn ra được những đơn_vị xuất_sắc nhất ."
580,"Ixora_Ho_Tram by Fusion - Siêu phẩm nghỉ_dưỡng được săn_đón trên thị_trường. Nhiều nhà_đầu_tư đã không ngần_ngại quyết_định chọn mua Ixora bởi_vì đây là dự_án hiếm_hoi sở_hữu tất_cả những yếu_tố tiên_quyết , độc_đáo và đẳng_cấp bậc nhất của nghỉ_dưỡng , đáp_ứng vượt trên mong_đợi về một ngôi nhà second-home đúng chuẩn quốc_tế ."
581,"TNEX Finance định_hướng trở_thành đơn_vị hàng_đầu về hiệu_quả và ứng_dụng công_nghệ. Sau 6 năm hoạt_động , Công_ty Tài_chính TNHH MTV Cộng_đồng ( FCCOM ) đổi tên thành Công_ty Tài_chính TNHH MTV TNEX ( tên viết tắt TNEX Finance ) và ra_mắt vào ngày 6/12 ."
582,"Samsung ViewFinity S9 5K lựa_chọn hàng_đầu của các nhà sáng_tạo nội_dung. Không_chỉ đem lại chất_lượng hiển_thị sắc nét trên từng chi_tiết với độ_phân_giải 5K , Samsung ViewFinity S9 còn được thiết_kế và trang_bị đầy_đủ các tính_năng để công_việc của những nhà sáng_tạo nội_dung chuyên_nghiệp trở_nên dễ_dàng hơn ."
583,"Trần_Thanh_Lực thắng tay cơ nổi_tiếng Dick_Jaspers tại World_Cup billiards. Tại World_Cup billiards carom 3 băng vòng đấu Ai_Cập , tay cơ Trần_Thanh_Lực thắng Dick_Jaspers ( Hà_Lan ) ở vòng bảng ."
584,240 triệu PC có_thể bị vứt bỏ khi hỗ_trợ Windows 10 kết_thúc. Canalys ước_tính 240 triệu PC có_thể bị đưa ra bãi rác sau tháng 10.2025 khi Microsoft kết_thúc hỗ_trợ miễn_phí cho Windows 10 .
585,"Dấu_hiệu nhận_biết ung_thư xoang. Ung_thư xoang dễ nhầm với cúm , cảm lạnh vì có các triệu_chứng như nghẹt mũi , chảy nước_mũi , chảy_máu cam , tê và đau trên mặt ."
586,"Phẫu_thuật tái_tạo lồng_ngực cho bé trai 9 tuổi bị lõm ngực bẩm_sinh nặng. Cuối tháng 6 vừa_qua , Quỹ_Nâng bước tuổi_thơ hỗ_trợ điều_trị phẫu_thuật thành_công giúp cải_thiện chứng lõm ngực bẩm_sinh gây chèn_ép nửa lá phổi của bé trai 9 tuổi người dân_tộc Ê Đê tại bệnh_viện FV ."
587,"Không phải người cha tốt thì sao có được những đứa con ngoan ,. Gần đây , một đoạn video tại tỉnh An_Huy , Trung_Quốc đã ghi lại cảnh một cậu bé 6 tuổi khuyên_giải bố sau khi bố_mẹ cãi nhau , thu_hút nhiều sự chú_ý của cư_dân mạng ."
588,"Học_viên Công_an nhân_dân chung tay bảo_vệ môi_trường. Tối 24.11.2023 , Cục Y_tế ( Bộ Công_an ) đã phối_hợp với Trường Đại_học Cảnh_sát nhân_dân tổ_chức vòng chung_kết cuộc thi Tìm_hiểu về môi_trường và tuyên_truyền về phòng , chống rác_thải nhựa khối các trường Công_an nhân_dân khu_vực phía Nam , Trường Đại_học Cảnh_sát nhân_dân xuất_sắc giành giải Nhất chung_cuộc ."
589,"Nhà_đất bị thu_hẹp vì khoảng lùi , hệ_số xây_dựng. Đã gần 2 năm kể từ ngày Quyết_định 56 về Quy_chế quản_lý kiến_trúc TP. HCM có hiệu_lực , đến nay nhiều người không dám xây nhà vì đất bị khoảng lùi , hệ_số xây_dựng ăn mất một diện_tích không nhỏ ."
590,"Cầu_thủ Thanh_Hoá bóp_cổ đối_phương ở V-League. Bình_Dương Trung_vệ Gustavo may_mắn thoát thẻ_đỏ khi phản_ứng , bóp_cổ hậu_vệ Võ_Minh_Trọng của Bình_Dương , ở vòng 7 V-League 2023-2024 ."
591,"Uống gì tốt cho phổi ,. Phổi dễ bị nhiễm_trùng do thời_tiết thay_đổi , tiếp_xúc với hoá_chất , khói thuốc_lá , có_thể làm sạch phổi bằng cách dùng các thức uống lành_mạnh ."
592,"Trường ĐH Thuỷ_lợi tiếp_tục là chủ nhà vòng_loại khu_vực miền Bắc. Hôm_nay , đại_diện Báo Thanh_Niên ( đơn_vị tổ_chức giải bóng_đá Thanh_Niên Sinh_viên Việt_Nam ) đã có buổi làm_việc với Trường ĐH Thuỷ_lợi về công_tác tổ_chức vòng_loại khu_vực miền Bắc mùa 2 ."
593,"Musk khoe robot hình người nhặt trứng , tập yoga. Optimus , robot hình người do Tesla sản_xuất , hiện di_chuyển thuần_thục , phần bàn_tay linh_hoạt có_thể cầm nắm vật kích_thước nhỏ ."
594,"3.000 thí_sinh thi đánh_giá tư_duy năm 2024 của Đại_học Bách_khoa Hà_Nội. Sáng nay , khoảng 3.000 thí_sinh tham_dự đợt 1 , mở_màn kỳ thi đánh_giá tư_duy đầu_tiên năm 2024 của Đại_học Bách_khoa Hà_Nội ."
595,Kỷ_lục ấn_tượng trong sự_nghiệp của Novak_Djokovic. Novak_Djokovic đã giành tổng_cộng 98 danh_hiệu trong sự_nghiệp và anh trở_thành tay_vợt đầu_tiên vô_địch 5 giải đấu trở lên trong 12 mùa giải .
596,"Mua_sắm dịp Black_Friday thế_nào là tỉnh_táo ,. Nhiều người đến các trung_tâm thương_mại để thử đồ , chọn mẫu_mã phù_hợp sau đó tự đặt_hàng trên website chính hãng để hưởng giảm_giá mạnh nhân_dịp Black_Friday ."
597,"5 công_trình thắng giải VinFuture 2023. Hà_Nội 11 nhà_khoa_học được vinh_danh với nghiên_cứu tiên_phong , liên_quan đến giống lúa năng_suất cao , lỗ thủng tầng ozone , pin mặt_trời , lưu_trữ bằng pin Lithium-ion và tiểu_đường , béo phì ."
598,"Khánh_Hoà công_bố kết_quả lấy phiếu tín_nhiệm 26 lãnh_đạo. Sáng 8/12 , HĐND tỉnh Khánh_Hoà công_bố kết_quả lấy phiếu tín_nhiệm đối_với 26 lãnh_đạo giữ chức_vụ do HĐND tỉnh khoá VII , nhiệm_kỳ 2021-2026 bầu ."
599,"Diện_mạo Sunshine_Golden_River cận_kề ngày bàn_giao. Hà_Nội Dự_án Sunshine_Golden_River tại khu đô_thị Nam_Thăng_Long - Ciputra đang hoàn_thiện những khâu cuối_cùng để đưa vào bàn_giao , sử_dụng trong tháng 12 ."
600,5 nước đầu_tư căn_hộ cho thuê hấp_dẫn nhất 2024. Có 2 quốc_gia châu_Âu và 3 nước Vùng Vịnh được đánh_giá là nơi đầu_tư tốt nhất năm sau ở phân khúc căn_hộ cho thuê .
601,"Lợi_ích rửa mặt_bằng nước lạnh. Rửa mặt_bằng nước lạnh có_thể thu nhỏ lỗ_chân_lông , giảm sưng mặt vào buổi sáng và hỗ_trợ làm dịu vết cháy nắng ."
602,"Giang_mai - bệnh gây hiếm_muộn ở nam_giới. Các biến_chứng của giang_mai có_thể gây xơ_hoá , teo tinh_hoàn , tắc_nghẽn đường_dẫn tinh ảnh_hưởng khả_năng sinh_sản của nam_giới ."
603,Nhiều nhà_máy không ngại tuyển lao_động lớn_tuổi. Doanh_nghiệp sản_xuất ở TP HCM không giới_hạn độ tuổi tuyển_dụng mở ra cơ_hội cho công_nhân lớn_tuổi mất việc ở các đợt cắt_giảm vừa_qua .
604,"Người đẹp Albania đăng_quang Miss_Earth 2023. TP HCM Drita_Ziri - thí_sinh 18 tuổi người Albania - vượt 84 cô gái để đăng_quang Miss_Earth 2023 , tại chung_kết tối 22/12 ."
605,"Mẹ_con người_mẫu bị sát_hại kinh_hoàng , nghi phạm là .. , chồng cũ của mẹ. Người_mẫu Nga Irina_Dvizova ( 42 tuổi ) và con gái Dayana ( 15 tuổi ) bị sát_hại khi đang lưu lại Thổ_Nhĩ_Kỳ , Hiện_tại , chồng cũ của Irina đã bị đưa vào diện nghi phạm bị truy_nã ."
606,Elon_Musk phiên_bản Trung_Quốc tích_cực luyện võ để thách đấu Zuckerberg. Người đàn_ông mang quốc_tịch Trung_Quốc có gương_mặt giống_hệt Elon_Musk đang tích_cực tập_luyện võ_thuật và đưa ra lời thách đấu_võ tự_do với Mark_Zuckerberg .
607,"IEA bi_quan về nhu_cầu dầu thế_giới. Theo Cơ_quan Năng_lượng Quốc_tế ( IEA ) , ngày_càng có nhiều bằng_chứng cho thấy nhu_cầu dầu thế_giới đang tăng chậm lại ."
608,Hệ_thống định_vị cho thành_phố ngầm lớn nhất thế_giới. Trung_Quốc Các nhà_nghiên_cứu phát_triển một hệ_thống định_vị chi_phí thấp và độ_chính_xác cao cho mạng_lưới đường_hầm 380 km chạy bên dưới tân_khu Hùng_An .
609,"Điểm mặt 4 thủ_phạm gây nhiễm_độc gan. Nhiễm_độc gan là tình_trạng tổn_thương gan do nhiều nguyên_nhân như thuốc , hoá_chất hoặc các chất gây hại gan có trong thực_phẩm hàng ngày ... , dẫn đến suy_giảm các chức_năng gan ."
610,"Ăn xong , tốt nhất nên uống nước lúc_nào ,. Theo y_học cổ_truyền , thời_điểm của các hoạt_động , kể_cả uống nước , là rất quan_trọng để duy_trì sức_khoẻ tổng_thể và tinh_thần thoải_mái ."
611,"Bóng_đá Việt_Nam vẫn nhớ chất nghệ_sĩ của ông Dido. Nhịp chân xử_lý đậm chất Samba như_thể làm_xiếc với trái bóng của HLV Dido trên sân tập , trong những tháng hè oi_ả giữa năm 2001 đã xâm_chiếm và sẽ luôn nằm yên_vị trong ký_ức của dàn cầu_thủ từng gắn_bó với ông ."
612,"Đề_nghị điều_tra việc xuyên_tạc phê_duyệt sách_giáo_khoa tiếng Trung_Quốc. Bộ GD & ĐT vừa phát đi thông_tin cảnh_báo , đồng_thời đề_nghị các cơ_quan_chức_năng điều_tra , xử_lý những đối_tượng xuyên_tạc quyết_định phê_duyệt sách_giáo_khoa tiếng Trung_Quốc lớp 3 , lớp 4 ."
613,"Nam_Đế_Games và Vietales hợp_tác phát_triển game lịch_sử Việt. Nam_Đế_Games và Vietales vừa ký_kết một thoả_thuận hợp_tác đáng chú_ý nhằm phát_triển game đề_tài sử Việt , thể_loại game vốn bị “ bỏ quên ” nhiều năm qua tại thị_trường Việt_Nam ."
614,"V-League lại hỗn_loạn HLV Gong_Oh_Kyun tố bị cầu_thủ đánh ; CĐV Bình_Định vây đội khách. Những trận đấu đầu_tiên của vòng 5 V-League 2023 - 2024 đã kết_thúc với rất nhiều điều đáng nhớ , chỉ có_điều , không phải là dấu_ấn chuyên_môn trên sân_cỏ , Thay vào đó , bạo_lực và hỗn_loạn mới là những điều được nhắc tới nhiều nhất ."
615,"Quảng_Ngãi Nhiều chính_sách hỗ_trợ học_sinh trường chuyên. HĐND tỉnh Quảng_Ngãi đã thông_qua chính_sách hỗ_trợ học_sinh nghèo , học_sinh là con thương_binh , liệt_sĩ , mồ_côi , học tại Trường THPT chuyên Lê_Khiết ( TP. Quảng_Ngãi ) với mức 1,3 triệu đồng / em / tháng ."
616,"LDG có chủ_tịch mới. Ông Ngô_Văn_Minh , quyền Tổng_giám_đốc LDG đảm_trách_chức Chủ_tịch HĐQT công_ty này từ ngày 19/12 , thay ông Nguyễn_Khánh_Hưng vừa bị miễn_nhiệm ."
617,"Becker_Đừng bao_giờ cược Nadal thua. Cựu_HLV của Novak_Djokovic , Boris_Becker cho rằng Rafael_Nadal có_thể tranh bất_cứ danh_hiệu nào khi tái_xuất ở mùa 2024 ."
618,"Trao giải cuộc thi Tiết_kiệm điện - Sáng_kiến Cool. Cuộc thi Tiết_kiệm điện - Sáng_kiến cool do báo Dân_trí và Casper Việt_Nam đồng tổ_chức nhận tổng_cộng 452 bài dự thi , cho thấy sức hút và sự quan_tâm lớn của người_dân đến chủ_đề tiết_kiệm điện ."
619,"Bình_Dương ra quy_định mới liên_quan đến phân lô bán nền. UBND tỉnh Bình_Dương vừa quy_định hàng_loạt khu_vực dự_án xây_dựng kinh_doanh nhà ở để bán hoặc cho thuê không được phép được chuyển_nhượng đất dưới hình_thức phân lô , bán nền ."
620,"Trâu húc chết người. Quảng_Trị Ông Hồ_Văn_Quân , 65 tuổi ở xã Hướng_Lập , huyện Hướng_Hoá vào rừng tìm trâu , bò thì bị một con trâu đực húc phải nhập_viện , hai ngày sau tử_vong ."
621,"Loạt hành_động hướng đến Net_Zero của Heineken Việt_Nam. Heineken Việt_Nam chuyển sang năng_lượng tái_tạo , nâng cao hiệu_suất và cắt_giảm phát thải nhằm đạt phát thải ròng bằng 0 ( Net_Zero ) trong toàn chuỗi giá_trị vào năm 2040 ."
