,0
0,Bất_ngờ ở vòng chung_kết giải bóng_rổ sinh_viên toàn_quốc. Bất_ngờ đã xảy ra ở vòng chung_kết giải bóng_rổ sinh_viên toàn_quốc ( NUC ) 2023 tại Hà_Nội khi đội đương_kim vô_địch nội_dung nam là Trường ĐH RMIT thất_thủ .
1,"Tắc ống dẫn tinh có con được không ,. Tắc ống dẫn tinh có_thể do nguyên_nhân bẩm_sinh hoặc mắc phải , tuy_nhiên nếu tinh_hoàn vẫn còn sản_xuất tinh_trùng thì quý ông vẫn có_thể có con ."
2,"Thống_kê tệ_hại của Man_Utd dưới thời HLV Erik_Ten_Hag. Trận thua Newcastle của Man_Utd khiến tương_lai HLV Erik_Ten_Hag thêm bấp_bênh , nhất_là khi người hâm_mộ nhìn vào thống_kê tệ_hại của Quỷ đỏ dưới thời_chiến lược gia người Hà_Lan ."
3,Sẽ có thuốc_tiêm giúp trẻ_hoá 50% và giảm tóc bạc. Các nhà_khoa_học đã tìm ra cách nhắm đến mục_tiêu ức_chế loại protein gây ra các vấn_đề dẫn đến lão_hoá .
4,"Vụ quỹ phụ_huynh 310 triệu đồng Trách_nhiệm của hiệu_trưởng ở đâu ,. Trong khi Ban đại_diện cha_mẹ học_sinh lớp Một 2 của Trường Tiểu_học Hồng_Hà đã chi 260 triệu đồng cải_tạo lớp_học , mua_sắm dụng_cụ học_tập nhưng hiệu_trưởng nhà_trường không nắm_bắt và xử_lý vụ_việc ."
5,"Làm gì ngăn biến_chứng bàn_chân do đái_tháo_đường ,. Tôi mắc bệnh đái_tháo_đường ba năm , muốn phòng_tránh các biến_chứng , nhất_là biến_chứng bàn_chân , thì cần làm gì , ( Quốc_Dũng , 56 tuổi , TP HCM )"
6,"Evergrande rơi vào tình_thế ngàn cân_treo sợi tóc. Doanh_nghiệp bất_động_sản nặng_nợ nhất thế_giới China_Evergrande_Group đang mắc_kẹt trong tình_thế ngàn cân_treo sợi tóc , khi thời_hạn hoãn phiên điều_trần sắp kết_thúc ."
7,"Phát_hiện ba loài chim quý_hiếm ở đầm Trà Ổ. Bình_Định Các cá_thể cò mỏ thìa , te mào , choắt mỏ thẳng đuôi đen đang có nguy_cơ tuyệt_chủng được phát_hiện ở khu_vực đầm Trà_Ổ , huyện Phù_Mỹ ."
8,"Làm_sao để không thành nạn_nhân của thông_tin độc_hại và lừa_đảo qua mạng ,. Đóng kẽ hở tâm_lý và trang_bị kiến_thức cơ_bản có_thể giúp người dùng tỉnh_táo và tránh xa được những cái bẫy đã giăng sẵn khi tham_gia môi_trường trực_tuyến ."
9,"Gene_Solutions đạt 2 giải_thưởng tại ESMO ASIA 2023. Tại ESMO ASIA 2023 , Gene_Solutions đã nhận 2 giải_thưởng trong lĩnh_vực sản_phẩm ung_thư ứng_dụng công_nghệ giải_trình gen thế_hệ mới Next-Generation Sequencing ( NGS ) ."
10,Apple được vinh_danh vì dừng sử_dụng da động_vật. Tổ_chức chuyên bảo_vệ quyền động_vật PETA công_bố Apple là công_ty của năm vì đã quyết_định ngừng sử_dụng da động_vật trên phụ_kiện của hãng .
11,5 trận chung_kết tranh đai vô_địch hấp_dẫn ở MMA Championship. Sự_kiện Lion_MMA_Championship 11 ( LC 11 ) sẽ diễn ra vào ngày 9/12 tới tại Cung thể_thao Quần_Ngựa ( Hà_Nội ) với 5 trận tranh đai vô_địch nảy_lửa .
12,"Người trúng đấu_giá thuê nhà_hàng Thuỷ_Tạ , Đà_Lạt bỏ cọc hơn 600 triệu đồng. Người trúng đấu_giá thuê nhà_hàng Thuỷ_Tạ , Đà_Lạt cho biết chấp_nhận việc huỷ kết_quả đấu_giá , sẽ không khiếu_nại hay đòi lại hơn 600 triệu đồng tiền cọc ."
13,"Sinh_viên Việt_Nam toả sáng tại cuộc thi Aptech_Techwiz. Cuộc thi Techwiz toàn_cầu lần thứ 4 quy_tụ hơn 3.200 thí_sinh thuộc 680 đội trên toàn thế_giới , Theo đó , các sinh_viên đến từ Việt_Nam đã giành được nhiều giải_thưởng trong lĩnh_vực trí_tuệ_nhân_tạo và máy học ."
14,"Khoai_lang siêu giàu chất dinh_dưỡng nhưng một_số người nên tránh ăn. Mặc_dù khoai_lang an_toàn và mang lại vô_số lợi_ích cho sức_khoẻ , nhưng vẫn có một_số đối_tượng cần hạn_chế tiêu_thụ hoặc tránh ăn khoai_lang hoàn_toàn ."
15,"Trữ trứng chờ gặp ý_trung_nhân. Không muốn lấy chồng cho có nhưng lo gặp được ý_trung_nhân thì quá tuổi sinh con , nhiều phụ_nữ quyết_định trữ trứng ."
16,"Cô gái châu_Phi biến rác nhựa thành loại gạch nhẹ hơn cả gạch bê_tông. Sản_phẩm của Gjenge_Makers bền hơn , nhẹ hơn và rẻ hơn so với gạch bê_tông ."
17,"Phần thi áo_tắm nóng_bỏng của thí_sinh Hoa_hậu Hoàn_vũ 2023. Sáng 16/11 ( giờ Việt_Nam ) , 84 người đẹp của Hoa_hậu Hoàn_vũ 2023 ( Miss_Universe ) đã hào_hứng bước vào phần thi trình_diễn áo_tắm ."
18,"Pulppy kỷ_niệm 25 năm-Vươn cao vươn xa Sự_kiện marathon cùng nhiều thông_điệp ý_nghĩa. Sự_kiện marathon Pulppy kỷ_niệm 25 năm - Vươn cao vươn xa do Công_ty TNHH New_Toyo_Pulppy Việt Nam tổ_chức đã diễn ra vào ngày 10.12.2023 vừa_qua , Sự_kiện nhằm kỷ_niệm 25 năm thành_lập , đồng_thời cũng là hoạt_động gây quỹ , lan_toả nhiều thông_điệp tốt_đẹp đến cộng_đồng ."
19,"Cách xử_trí nghẹt mũi ngay tại nhà. Nghẹt mũi không quá nghiêm_trọng nhưng nếu kéo_dài sẽ gây khó_chịu , ảnh_hưởng tới sinh_hoạt hằng ngày , Những cách xử_trí đơn_giản tại nhà sẽ giúp bạn giảm khó_chịu do nghẹt mũi đem đến ."
20,"Chủ_tịch nước Hợp_tác thương_mại Việt_Nam - Singapore phát_triển tốt_đẹp. Dự kỷ_niệm 10 năm VSIP Quảng_Ngãi , ông Võ_Văn_Thưởng cho rằng VSIP là minh_chứng cho thấy quan_hệ thương_mại Việt_Nam - Singapore phát_triển tốt_đẹp ."
21,"Quảng_Ngãi vượt khó , thu ngân_sách vượt dự_toán được giao. Tuy tình_hình kinh_tế còn nhiều khó_khăn nhưng nguồn thu ngân_sách của tỉnh Quảng_Ngãi vẫn vượt dự_toán Trung_ương giao ."
22,"Năm sau thanh_tra hoạt_động xây_dựng của Vietinbank , EVN. Vietinbank , EVN , Handico và các tỉnh như Phú_Thọ , Nghệ_An , Bến_Tre , Long_An , Đồng_Tháp vào kế_hoạch thanh_tra của Bộ Xây_dựng năm 2024 ."
23,"Pha vợt sale chớp_nhoáng tại LDG 13 triệu cổ_phiếu bay trong nháy_mắt. Trong khi nhiều cổ_phiếu trên thị_trường bị chốt lời và điều_chỉnh thì LDG đã có pha hồi_phục ngoạn_mục , hơn 13 triệu cổ_phiếu được hấp_thụ giá_sàn chớp_nhoáng ."
24,"Thực_hư thông_tin 7 thanh_niên tấn_công cảnh_sát 141 để giải_cứu bạn. Công_an TP Hà_Nội cho biết , thông_tin tổ công_tác Y 4/1 41 bị một nhóm thanh_niên dùng vũ_khí tấn_công để giải_cứu bạn bị tạm giữ , là sai sự_thật , gây ảnh_hưởng xấu dư_luận xã_hội ."
25,"Ngân_hàng Nhà_nước Người_dân không ưu_tiên mua nhà lúc này. Dư_nợ cho vay tiêu_dùng - tự sử_dụng bất_động_sản đã giảm 0,7% , theo Ngân_hàng Nhà_nước , cho thấy khách_hàng đang không ưu_tiên nhu_cầu mua nhà ."
26,"Sam giải_đáp thắc_mắc về người chồng bí_ẩn. Dù đã công_khai đăng_ký kết_hôn và bước vào những tháng cuối của thai kỳ nhưng danh_tính bạn_đời của Sam vẫn là một dấu_hỏi lớn , Trước mọi đồn đoán của cư_dân mạng , Sam nhanh_chóng làm rõ ."
27,Runner bỏ_cuộc khi đang dẫn_đầu đường_đua marathon. Trung_Quốc Một chân chạy Kenya bỏ_cuộc ở mốc 25 km do hạ thân_nhiệt khi đang dẫn_đầu giải Hàng Châu_Marathon 2023 tại Trung_Quốc ngày 17/12 .
28,"Bệnh da cánh bướm. Bệnh da bướm xảy ra do gene bị lỗi , hiện không_thể chữa khỏi , chỉ có_thể tập_trung vào giảm đau và điều_trị biến_chứng như nhiễm_trùng , ung_thư da ."
29,"Mẹo sử_dụng lò_vi_sóng tốt cho sức_khoẻ , bạn đã biết chưa ,. Nấu_ăn bằng lò_vi_sóng rất tiện_lợi vì nó đơn_giản và cực_kỳ nhanh_chóng , Tuy_nhiên , nhiều người lo_ngại nó có_thể làm hỏng các chất dinh_dưỡng tốt cho sức_khoẻ ."
30,Căn penthouse 280 m2 tối_giản với khoảng sân ngập nắng. TP HCM Lựa_chọn đưa toàn_bộ không_gian sinh_hoạt chung lên tầng 2 giúp gia_chủ có_thể tận_hưởng khoảng sân ngập_tràn ánh nắng .
31,"Mỹ_nhân Hoa ngữ đổ_vỡ hôn_nhân , bị khán_giả ghét_bỏ vì bê_bối ngoại_tình. Sau bê_bối ngoại_tình , sự_nghiệp và danh_tiếng của Chúc Anh Đài Đổng_Khiết đều bị ảnh_hưởng , Ở tuổi ngoài 40 , cô sống lặng_lẽ , kín_tiếng và hầu_như không công_khai chuyện tình_cảm ."
32,"Meta bị phạt vì quảng_cáo cờ_bạc trên Facebook. Italy_Meta bị phạt 6,4 triệu USD vì các quảng_cáo cờ_bạc xuất_hiện trên Facebook và Instagram ."
33,"9 không , 1 cần trong phòng_ngừa tội_phạm công_nghệ_cao. Khuyến_cáo 9 không , 1 cần trong phòng_ngừa tội_phạm công_nghệ_cao trên không_gian mạng , lãnh_đạo Sở Thông_tin và Truyền_thông Cà_Mau lưu_ý người_dân quan_trọng nhất là nâng cao cảnh_giác ."
34,"Có 5 dấu_hiệu này bạn cần cho gan nghỉ_ngơi ngay. Ở giai_đoạn đầu , bạn có_thể đảo_ngược các tổn_thương gan , Có một_số cách bạn có_thể làm để giúp gan được nghỉ_ngơi và ngăn_ngừa tổn_thương vĩnh_viễn ."
35,Chicilon_Media là nhà_tài_trợ kim_cương cho hội_nghị về bất_động_sản. Chicilon_Media là nhà_tài_trợ kim_cương cho Hội_nghị Bất_động_sản Việt_Nam - VRES 2023 diễn ra tại Hà_Nội ngày 12/12 và TP HCM ngày 14/12 .
36,"3 bí_quyết sống khoẻ của người phụ_nữ 106 tuổi. Anh Cụ bà Katie_MacRae khoẻ_mạnh ở tuổi ngoài 100 do sở_thích làm_vườn , lối sống bận_rộn và thói_quen mỉm cười với cả người xa_lạ ."
37,"Bệnh_tình dục Ngã_ngửa vì những hiểu lầm nguy_hiểm. Bệnh_tình dục ngày_càng phổ_biến , Nhiều người ngã_ngửa vì tưởng hành_vi vô_hại nhưng lại gây hậu_quả nặng_nề ."
38,"Hạnh_kiểm khá có xin học_bổng Australia được không ,. Em muốn du_học Australia nhưng lo hạnh_kiểm khá ảnh_hưởng đến việc xin học_bổng ."
39,"5 tư_thế yoga tốt cho phụ_nữ mãn_kinh. Tư_thế yoga chiến_binh tăng_cường tuần_hoàn , giảm mệt_mỏi ; động_tác gác chân lên tường hỗ_trợ ngủ ngon thời_kỳ mãn_kinh ."
40,"Quốc_lộ 13 qua TP HCM được đề_xuất đổi tên thành 30 Tháng 4. Đoạn quốc_lộ 13 từ cầu Bình_Triệu đến cầu Vĩnh_Bình , dài khoảng 6 km , được chính_quyền TP Thủ_Đức đề_nghị đổi tên thành đường 30 Tháng 4 ."
41,"Nữ_sinh 10 tuổi dũng_cảm cứu 3 trẻ đuối nước. Thấy 3 em nhỏ đang bị đuối nước , Rơ_Châm_Ư dũng_cảm nhảy xuống lần_lượt đưa cả 3 lên bờ , Tuy_nhiên một nạn_nhân là em ruột Ư đã không qua khỏi ."
42,Bóng_đá Trung_Quốc tuyên_bố xử nghiêm vụ đánh nhau tại AFC Champions_League. Liên_đoàn bóng_đá Trung_Quốc ( CFA ) tuyên_bố sẽ xử_lý nghiêm những người vi_phạm trong trận đấu giữa Chiết_Giang_FC ( Trung_Quốc ) và Buriram_United ( Thái_Lan ) .
43,"Trump_Chứng khoán lên đỉnh chỉ khiến người giàu càng giàu thêm. Cựu tổng_thống Mỹ hôm 17/12 đưa ra nhiều bình_luận về kinh_tế Mỹ , từ chứng_khoán đến lạm_phát ."
44,"Khối ngoại trở_lại gom cổ_phiếu Thế_Giới Di_Động. Sau khoảng ba tháng đua lệnh bán ròng , nhà_đầu_tư nước_ngoài hôm_nay mua ròng hơn 100 tỷ đồng cổ_phiếu Thế_Giới Di_Động ."
45,"Cảnh_báo xuyên_tạc Quyết_định phê_duyệt sách_giáo_khoa tiếng Trung_Quốc lớp 3 , 4. Bộ GD-ĐT cảnh_báo hiện_nay trên mạng xã_hội đang xuất_hiện tình_trạng xuyên_tạc về Quyết_định phê_duyệt sách_giáo_khoa tiếng Trung_Quốc lớp 3 , lớp 4 của Bộ GD-ĐT và khẳng_định các cơ_quan_chức_năng điều_tra , xử_lý những hành_vi sai_phạm trên theo đúng quy_định của pháp_luật ."
46,"Bitcoin hồi_phục sau nhiều hoài_nghi. Sau khi lao dốc vào năm 2022 , Bitcoin đã có sự trở_lại đầy ấn_tượng trong năm 2023 , bất_chấp bối_cảnh kinh_tế ảm_đạm , giá tiền số sụt_giảm và khối_lượng giao_dịch tiền số ở mức thấp ."
47,"Bầu Đức muốn phát_hành cổ_phiếu thu về 1.300 tỷ đồng Lộ diện 3 nhà_đầu_tư. Bầu Đức muốn thu tiền trả nợ trái_phiếu , cơ_cấu nợ công_ty con thông_qua phát_hành cổ_phiếu , Danh_tính 3 nhà_đầu_tư lộ diện , trong đó có 2 tổ_chức liên_quan nhiều cái tên lớn ."
48,"UBKT Trung_ương xác_định vi_phạm của hàng_loạt cán_bộ cấp cao. Trưởng ban Kinh_tế Trung_ương Trần_Tuấn_Anh , nguyên Phó thủ_tướng Trịnh_Đình_Dũng và hàng_loạt cán_bộ cấp cao bị xác_định trách_nhiệm trong các vi_phạm liên_quan điện gió , cung_ứng xăng_dầu ."
49,Djokovic bị nghi_ngờ khả_năng giành Golden_Slam. Cựu tay_vợt số hai thế_giới Alex_Corretja cho rằng rất khó để Novak_Djokovic giành cả bốn Grand_Slam và Olympic trong năm 2024 .
50,Lựa_chọn nhà_đầu_tư xây_dựng sân_bay tại Quảng_Trị. Tỉnh Quảng_Trị đã ra quyết_định phê_duyệt kết_quả lựa_chọn nhà_đầu_tư thực_hiện Dự_án thành_phần 2 - Xây_dựng Cảng_hàng_không Quảng_Trị theo phương_thức đối_tác công tư ( PPP ) .
51,"Djokovic thoát hiểm ngoạn_mục , tiến bước ở Paris_Masters. Novak_Djokovic vất_vả giành chiến_thắng 4-6 , 7-6 ( 2 ) , 6-4 trước Tallon_Griekspoor để giành vé tiến vào tứ_kết Paris_Masters , Tay_vợt người Serbia nối dài chuỗi trận thắng liên_tiếp lên con_số 15 ."
52,"9 xu_hướng thời_trang nổi_bật trong năm 2023. Những xu_hướng này có tính ứng_dụng cao , dễ kết_hợp nên được nhiều tín_đồ thời_trang ưa_chuộng ."
53,Thủ_tướng đề_nghị ngân_hàng Nhật tham_gia tái cơ_cấu nhà_băng yếu_kém. Ngân_hàng Mizuho - một trong ba ngân_hàng lớn nhất Nhật_Bản - được Thủ_tướng Phạm_Minh chính_đề nghị tham_gia tái cấu_trúc ngân_hàng yếu_kém của Việt_Nam .
54,"Du_lịch , dịch_vụ sẽ là ngành kinh_tế mũi_nhọn ở TP. Phúc_Yên. 20 năm qua , nền kinh_tế của TP. Phúc_Yên đã có bước phát_triển vượt_bậc , thu ngân_sách cao , góp_phần đưa Vĩnh_Phúc trở_thành một trong những tỉnh tự cân_đối được ngân_sách , có_điều tiết về T.Ư , Sau công_nghiệp , các hoạt_động dịch_vụ , du_lịch đang phát_triển và sẽ là ngành kinh_tế mũi_nhọn ."
55,"Giá xăng giảm gần 1.000 đồng một lít. Mỗi lít xăng giảm 920-960 đồng , các mặt_hàng dầu cũng hạ thêm 550-780 đồng , từ 15h hôm_nay ."
56,"Tập_đoàn lớn của UAE muốn Việt_Nam hợp_tác về cảng biển , đô_thị thông_minh. Khẳng_định Việt_Nam là ưu_tiên chiến_lược hàng_đầu , lãnh_đạo Tập_đoàn International_Holdings_Company của UAE muốn tìm_hiểu cơ_hội hợp_tác trong lĩnh_vực cảng biển , logistics , đô_thị thông_minh ."
57,"Những mẫu tên_lửa_vũ_trụ mới dự_kiến phóng năm 2024. Một_số tên_lửa mới của châu_Âu và Mỹ sẽ phóng năm sau , khi ngành hàng_không vũ_trụ thiếu phương_tiện phóng do số_lượng vệ_tinh tăng ."
58,"CEO Galaxy_Studio_Rạp phim sẽ trở_thành điểm giải_trí tích_hợp. Bà Mai_Hoa - CEO Galaxy_Studio - nói rạp Việt không đơn_thuần là điểm chiếu_phim truyền_thống , mà phát_triển thành trung_tâm văn_hoá sôi_động ."
59,"Hà_Nội lý_giải việc chung_cư của Tân_Hoàng_Minh bị treo sổ hồng. Cư_dân chung_cư D.ElDorado 2 của Tân_Hoàng_Minh , quận Tây_Hồ , Hà_Nội chưa được cấp sổ hồng vì dự_án đang thế_chấp tại Ngân_hàng Sài_Gòn - Hà_Nội ( SHB ) ."
60,"Thủ_khoa thi đánh_giá tư_duy Bách_khoa Hà_Nội đạt 95,85/100 điểm. Điểm trung_bình của hơn 2.700 thí_sinh dự kỳ thi đánh_giá tư_duy đợt 1 của Đại_học Bách_khoa Hà_Nội là 52,48/100 , cao nhất là 95,85 điểm ."
61,"Mã_Quốc_Minh tung ảnh lễ cưới. Tài_tử Hong_Kong_Mã_Quốc Minh tung bộ ảnh cưới lãng_mạn bên diễn_viên Thang_Lạc_Văn , tại Thái_Lan ."
62,Trọng_Hiếu được khán_giả vây quanh khi diễn ở nước_ngoài. Trong lúc các nghệ_sĩ khác phát_hành MV thì Trọng_Hiếu gây chú_ý khi ra_mắt series thực_tế Trọng_Hiếu kinh_khủng khiếp .
63,"VAR được áp_dụng trong ngày HLV Gong_Oh_Kyun ra_mắt V-League. Trận đấu Công_an Hà_Nội gặp Hải_Phòng trên sân Lạch_Tray sẽ được áp_dụng công_nghệ video hỗ_trợ trọng_tài ( VAR ) , Đây là trận đầu_tiên HLV Gong_Oh_Kyun dẫn_dắt CLB Công_an Hà_Nội tại V-League 2023-24 ."
64,"Quân_đoàn 12 diễn_tập chiến_thuật bắn đạn thật. Quân_đoàn 12 và các lực_lượng tham_gia diễn_tập chiến_thuật bắn đạn thật năm 2023 tại Trường_bắn quốc_gia 1 , tỉnh Bắc_Giang , sáng 23/12 ."
65,"Con gái Dương_Mịch chịu nhiều áp_lực , vướng nghi_vấn bị trầm_cảm. Theo bố của Lưu_Khải_Uy , cuộc hôn_nhân đổ_vỡ giữa nam diễn_viên và Dương_Mịch khiến con gái của họ phải chịu nhiều tổn_thương tâm_lý ."
66,Lê_Dương Bảo_Lâm mâu_thuẫn với bà_xã trong cách dạy con. Trong khi Lê_Dương Bảo_Lâm không muốn ép con học sớm thì bà_xã Quỳnh_Quỳnh lại có suy_nghĩ ngược_lại .
67,"Vì sao dự_án khu đô_thị sinh_thái hơn 50.400 tỷ đồng vẫn nằm trên giấy ,. Dự_án khu đô_thị sinh_thái , du_lịch , vui_chơi giải_trí ở Hà_Tĩnh qua nhiều năm vẫn chưa triển_khai , Đại_biểu nói rằng đã nêu câu hỏi về vấn_đề này tại nhiều kỳ họp nhưng chưa được giải_quyết thấu_đáo ."
68,"Ăn quá no tạo gánh nặng cho sức_khoẻ đường tiêu_hoá. Ăn quá no không_chỉ dừng lại ở việc nạp vào cơ_thể lượng calo vượt nhu_cầu , gây thừa cân mà_còn ảnh_hưởng đến cơ_thể theo nhiều cách khác nhau , Trong đó , đường tiêu_hoá là cơ_quan chịu hậu_quả đầu_tiên và trực_tiếp bởi thói_quen này ."
69,"Vượt qua Medvedev , Alcaraz gặp Djokovic ở bán_kết ATP Finals. Carlos_Alcaraz đã đánh_bại Daniil_Medvedev với tỷ_số 6-4 , 6-4 để vượt lên đứng đầu_bảng Đỏ và cùng tay_vợt người Nga vào bán_kết ."
70,"Nhận_biết nốt_ruồi hay ung_thư hắc tố như_thế_nào ,. Khoảng 10 đến 20 % ung_thư hắc tố có liên_quan tới nốt_ruồi , Nó thường phát_triển trên một nốt_ruồi sẵn có thay bị đụng_chạm sờ_mó , hoặc bị ánh nắng tác_động nhiều lần ."
71,"Đại_gia Như Loan cùng loạt nhà_đầu_tư nhận quà từ ngài thị_trường. Chứng_khoán bất_ngờ đảo chiều tăng mạnh phiên chiều 20/10 , loạt cổ_phiếu trong đó có QCG tăng trần , Giới đầu_tư hân_hoan nhận quà từ thị_trường ."
72,"Địa_chỉ tin_cậy của nhà_trường , học_sinh. Chương_trình Tư_vấn mùa thi do Báo Thanh_Niên tổ_chức đã đồng_hành cùng thí_sinh suốt 25 năm qua không_chỉ là một kênh cung_cấp thông_tin mới về thi_cử , định_hướng cho học_sinh chọn ngành , nghề , trường để xét tuyển mà_còn là cầu_nối giúp học_sinh liên_lạc , trao_đổi , giải_đáp thắc_mắc với các trường đại_học , cao_đẳng , trung_cấp ."
73,"Bằng liên_thông ĐH chính_quy có khác vừa làm vừa học ,. Nhiều sinh_viên tốt_nghiệp CĐ và trung_cấp thắc_mắc hiện_nay liên_thông ĐH giữa hình_thức chính_quy và vừa làm vừa học có gì khác nhau về chương_trình học , bằng_cấp ... ,"
74,"Triển_khai đề_án 1 triệu ha lúa chất_lượng cao tại Tây_Nam_Bộ. Đề_án 1 triệu ha lúa chất_lượng cao , phát thải thấp gắn với tăng_trưởng xanh bắt_đầu triển_khai tại Hậu_Giang , sáng 12/12 ."
75,"Đại_biểu HĐND chất_vấn về phòng cháy chữa_cháy tại TPHCM. Quận 12 có nhu_cầu về nhà ở cao , các đại_biểu đã chất_vấn Chủ_tịch UBND quận về các vấn_đề liên_quan đến quản_lý chung_cư và công_tác đảm_bảo phòng cháy chữa_cháy trên địa_bàn ."
76,"Việt_Nam đề_xuất 4 nhóm ưu_tiên hợp_tác Mê_Kông - Lan_Thương. Ngày 7.12 , Hội_nghị Bộ_trưởng Ngoại_giao hợp_tác Mê_Kông - Lan_Thương ( MLC ) lần thứ 8 đã diễn ra tại Bắc_Kinh ( Trung_Quốc ) với sự tham_dự của các Bộ_trưởng Ngoại_giao và đại_diện các nước thành_viên hợp_tác MLC gồm Campuchia , Lào , Myanmar , Thái_Lan , Trung_Quốc và Việt_Nam ."
77,Microsoft bị điều_tra vì đầu_tư 10 tỷ USD vào OpenAI. Cơ_quan quản_lý Anh và Mỹ lo_ngại việc Microsoft đầu_tư hàng tỷ USD vào OpenAI sẽ dẫn đến độc_quyền trong lĩnh_vực trí_tuệ_nhân_tạo .
78,"Tam_giác kinh_tế Rạch_Giá - Hà_Tiên - Phú_Quốc giúp Kiên_Giang bứt_phá. Đến năm 2030 , Kiên_Giang là tỉnh có chất_lượng sống cao của ĐBSCL , là trung_tâm kinh_tế biển quốc_gia với tam_giác kinh_tế đô_thị , thương_mại và dịch_vụ hướng biển là Rạch_Giá - Hà_Tiên - Phú_Quốc ."
79,Vụ nổ_mìn đá văng ra quốc_lộ Kiểm_tra vật_liệu nổ. UBND thị_xã Hoàng_Mai đã có văn_bản đề_nghị UBND tỉnh Nghệ_An chỉ_đạo các cơ_quan chuyên_ngành tổ_chức kiểm_tra sử_dụng vật_liệu nổ của Công_ty cổ_phần đá Hoàng_Mai .
80,"Hợp_tác với đại_học hàng_đầu thế_giới để đào_tạo lãnh_đạo kinh_doanh cho Việt_Nam. Đại_học Kinh_tế TPHCM ( UEH ) và Đại_học Công_nghệ Nanyang của Singapore ( NTU Singapore ) vừa phối_hợp triển_khai chương_trình Thạc_sĩ quản_trị kinh_doanh quốc_tế ( IMBA ) , kết_hợp chuyên_môn chung của cả hai trường để đào_tạo học_viên ."
81,"Nhiều startup blockchain Việt tiềm_ẩn rủi_ro bảo_mật. Cục An_toàn thông_tin đánh_giá nhiều startup blockchain , tài_chính phi tập_trung tại Việt_Nam còn chưa nhận_thức đủ về bảo_mật ."
82,"Trường ĐH Kinh_tế - Tài_chính TP. HCM nhận chứng_nhận kiểm_định chất_lượng cơ_sở giáo_dục và trao bằng thạc_sĩ 2023. Ngày 17.12.2023 Trường ĐH Kinh_tế - Tài_chính TP , HCM ( UEF ) đã tổ_chức Lễ nhận chứng_nhận kiểm_định chất_lượng cơ_sở giáo_dục chu_kỳ 2 ( 2019 - 2023 ) và trao bằng tốt_nghiệp thạc_sĩ 2023 ."
83,"Harman_Kardon trình_làng loa di_động nhỏ gọn Luna. Harman_Kardon vừa ra_mắt và mở bán dòng sản_phẩm Luna , loa di_động nhỏ gọn với âm_thanh đỉnh_cao và vẻ ngoài tinh_tế được tạo nên từ những vật_liệu cao_cấp ."
84,"Người đàn_ông hoại_tử cổ_chân do vết rắn cắn cách đây 20 năm. Ngày 29/11 , thông_tin từ Bệnh_viện Đa_khoa tỉnh Thanh_Hoá , các bác_sĩ Khoa_Chỉnh hình - Bỏng mới phẫu_thuật thành_công cho bệnh_nhân bị hoại_tử cổ_chân do vết rắn cắn cách đây 20 năm ."
85,"Sao nhí 2 lần đoạt Bông sen vàng Mai_Cát_Vi_Muốn trở_thành Ngô_Thanh_Vân. Với Mai_Cát_Vi , Ngô_Thanh_Vân là một thần_tượng trong nghề diễn , Sao nhí sinh năm 2009 mong_muốn được thử sức ở những dạng vai hành_động trong tương_lai ."
86,"Loạt bê_bối tài_chính chấn_động của Samsung , Toshiba , Apple .... Nhiều tập_đoàn đình_đám toàn_cầu cũng từng dính phải những bê_bối tài_chính nghiêm_trọng , từ bê_bối trốn_thuế của Apple , hối_lộ của Samsung cho tới vụ gian_lận kế_toán của Toshiba ..."
87,"Công_ty WPP bị phạt lần thứ 3 trong năm vì quảng_cáo phạm_pháp. Ngày 28/11 , Cục Phát_thanh , truyền_hình và thông_tin điện_tử đã ban_hành Quyết_định xử_phạt vi_phạm hành_chính đối_với Công_ty TNHH Truyền_thông WPP ( GroupM ) ."
88,"Chìm tàu , 5 người mất_tích ở biển Khánh_Hoà. Tàu đánh_bắt cá_ngừ đại_dương trên đường về bờ , đi qua biển Khánh_Hoà bị sóng lớn đánh_phá nước , chìm dần , 5 người mất_tích , khuya 22/12 ."
