,0
1062,Hai thay_đổi trên OWGR từ 2024. Bảng golf nam chuyên_nghiệp thế_giới ( OWGR ) từ năm tới sẽ tăng điểm cho chủ_nhân nhiều cup cũng như nhà vô_địch giải_giới_hạn danh_sách đấu .
1063,"Cháy nhà ở Vĩnh_Phúc , 3 mẹ_con thiệt_mạng. Một ngôi nhà ở Vĩnh_Phúc cháy lúc rạng sáng nay khiến người mẹ trẻ và hai đứa con_nhỏ thiệt_mạng ."
1064,"Chủ_nhân giải VinFuture 2023 chia_sẻ cách vượt sợ thất_bại trong nghiên_cứu. Sau lễ vinh_danh giải VinFuture 2023 , sáng 21/12 , các nhà_khoa_học đạt giải có buổi gặp_mặt giao_lưu truyền_cảm hứng tại trường Đại_học VinUni ."
1065,"3 lý_do không_thể bỏ lỡ_cơ hội đầu_tư shophouse Sơn_Đồng_Center. Sơn_Đồng_Center hút khách nhờ sở_hữu những tiềm_năng vàng giúp nhà_đầu_tư thu lợi khi đón_đầu sóng tăng_giá thị_trường bất_động_sản Tây Hà_Nội , Vị_trí đắt_giá , lợi_thế pháp_lý và chủ đầu_tư uy_tín là yếu_tố tiên_quyết để nhà_đầu_tư lựa_chọn dự_án ."
1066,"Ancelotti sốc vì 3 cầu_thủ Real đứt dây_chằng. Tây_Ban_Nha Sau trận thắng Villarreal 4-1 ở vòng 17 La_Liga , HLV Carlo_Ancelotti thừa_nhận không ngờ cảnh mất ba cầu_thủ vì đứt dây_chằng từ đầu mùa là David_Alaba , Thibaut_Courtois và Eder_Militao ."
1067,"Dầu_nhớt đổ kéo_dài từ TPHCM đến Bình_Dương , hàng chục xe_máy vồ_ếch. Đường ĐT743 đoạn giáp_ranh giữa TP Dĩ_An và TP Thuận_An ( Bình_Dương ) xuất_hiện vết nhớt kéo_dài trên đoạn đường hơn 5km khiến hàng chục xe_máy vồ_ếch trong đêm ."
1068,"Môn liên_kết moi tiền phụ_huynh Ai kiểm_tra , quản_lý chất_lượng ,. Mặc_dù được đưa vào giảng_dạy trong nhà_trường nhưng việc kiểm_soát chất_lượng , nội_dung của các tiết học liên_kết , chất_lượng của cán_bộ dạy vẫn là bài_toán khó với các nhà_quản_lý ."
1069,"Khối cơ ảnh_hưởng đến khả_năng miễn_dịch của người lớn_tuổi thế_nào ,. PGS.TS Vũ_Thị_Thanh_Huyền cho biết việc mất khối cơ sẽ ảnh_hưởng đến khả_năng miễn_dịch và sức_khoẻ tổng_thể , tại toạ_đàm về dinh_dưỡng cho người lớn_tuổi trên VnExpress ."
1070,"Hai nữ_sinh lớp 7 gặp nạn khi đi tắm sông. Quảng_Ngãi Trong lúc cùng nhóm bạn ra sông vui_chơi , nữ_sinh lớp 7 trượt chân xuống cát lún ở Cửa Đại , em đi cùng bơi ra cứu nhưng cả hai bị đuối nước ."
1071,"HLV CLB TPHCM phát_biểu bất_ngờ về chiến_thắng trước Thể_Công_Viettel. Ngay đến HLV tạm_quyền Phùng_Thanh_Phương của CLB TPHCM cũng thừa_nhận ông bất_ngờ khi đội nhà đánh_bại Thể_Công_Viettel , đội bóng rất mạnh tại V-League."
1072,"Sao Liverpool gửi thông_điệp xúc_động sau vụ bố_mẹ đồng_đội bị bắt_cóc. Sau bàn thắng mở tỷ_số cho Liverpool , tiền_đạo Diogo_Jota đã có thông_điệp xúc_động đến đồng_đội Luiz_Diaz - người có bố_mẹ bị bắt_cóc ở Colombia ."
1073,"Nữ_sinh Việt ẵm học_bổng 3,3 tỷ từ đại_học danh_giá bậc nhất Canada. Giành học_bổng trị_giá 192.000 CAD ( hơn 3,3 tỷ đồng ) từ Đại_học Toronto , Phạm_Khánh_Linh muốn áp_dụng kiến_thức học được theo_đuổi giấc mơ xây_dựng một mô_hình giáo_dục toàn_diện ."
1074,Nga cảnh_báo về uy_tín của đồng euro. Thống_đốc Ngân_hàng Trung_ương Nga Elvira_Nabiullina cho rằng uy_tín của đồng euro đang bị đe_doạ khi Brussels phong_toả tài_sản của Nga .
1075,"Hoa_hậu Mai_Phương_Đi du_học Anh , an_phận làm công chức. 21 năm sau khi đăng_quang Hoa_hậu Việt_Nam 2002 , Mai_Phương vẫn là cái tên được nhiều người nhắc đến dù cô đã không còn hoạt_động nghệ_thuật , vắng bóng hoàn_toàn ở các sự_kiện ."
1076,"Lạc cực_kỳ bổ_dưỡng , nam_giới có nên ăn ,. Không_chỉ là nguồn protein tuyệt_vời , lạc còn hỗ_trợ sức_khoẻ tim_mạch , thậm_chí tăng_cường chức_năng tình_dục cho quý ông ."
1077,"Man_City săn_lùng các tài_năng trẻ hàng_đầu trong chương mới của HLV Pep_Guardiola. Theo nhà_báo chuyên_gia săn thông_tin chuyển_nhượng Fabrizio_Romano , CLB Man_City đang ráo_riết săn_lùng các tài_năng trẻ hàng_đầu của bóng_đá thế_giới cho một chương mới của đội bóng ."
1078,"Trường Quốc_tế Anh Việt kỷ_niệm 10 năm thành_lập_trường. Trường Quốc_tế Anh Việt ( BVIS ) Hà_Nội tổ_chức lễ kỷ_niệm trong không_khí ấm_áp giữa tình bạn , sự gắn_kết thầy và trò , đánh_dấu mốc sự_kiện 10 năm thành_lập và phát_triển ."
1079,"Đề_xuất cơ_chế đặc_thù cho điện gió ngoài khơi , khí LNG. Trước việc các dự_án điện_khí LNG , điện gió ngoài khơi gặp khó , các doanh_nghiệp đề_xuất cơ_chế đặc_thù để tháo_gỡ ."
1080,"Ai_ai cũng đỗ đại_học , số_lượng có đè_bẹp chất_lượng ,. Đỗ đại_học giờ_đây còn dễ hơn trượt đại_học , Niềm vui đó lại kéo_theo không ít lấn_cấn , băn_khoăn và cả lo_lắng liệu số_lượng tuyển_sinh có chỉ để lấp cho đầy chỗ ,"
1081,"Thầy_giáo 8X dạy sinh_viên làm TikTok để dễ kiếm việc_làm. Thầy_giáo Hồ_Lê_Anh_Hoàng ( 1988 ) , Trưởng bộ_môn Điện_tử Viễn_thông ( Khoa_Kỹ thuật công_nghệ , Trường ĐH Văn_Hiến ) được sinh_viên rất yêu thích vì sự sáng_tạo , năng_động trong giảng_dạy , Ngoài hướng_dẫn chuyên_môn , thầy Hoàng khuyến_khích sinh_viên làm thêm TikTok để , dễ xin việc ."
1082,"Ancovi_Milk - Giải_pháp hữu_hiệu bổ_sung dinh_dưỡng cho cơ_thể. Với công_thức đặc_chế từ sữa non colostrum nhập_khẩu từ Mỹ với 24 tỷ lợi khuẩn Probiotic , cùng nhiều thành_phần , nhóm dưỡng_chất đặc_biệt , Ancovi_Milk là giải_pháp hữu_hiệu trong việc hỗ_trợ bổ_sung dinh_dưỡng cho cơ_thể ."
1083,"Lợi_ích sức_khoẻ bất_ngờ của trái hồng. Trái hồng nhờ hương_vị thơm ngọt nên rất được nhiều người ưa_thích , Không_những vậy , hồng còn mang lại nhiều lợi_ích sức_khoẻ mà không phải ai cũng biết ."
1084,"Quốc_Trí giành Á vương 3 tại cuộc thi Nam vương Du_lịch Thế_giới 2023. Á_quân Gương_mặt truyền_hình 2022 - MC Quốc_Trí - giành Á vương 3 tại cuộc thi Nam vương Du_lịch Thế_giới 2023 vừa diễn ra tại Brazil , Ngôi_vị Nam vương thuộc về đại_diện của Thái_Lan ."
1085,"Mùa sốt_xuất_huyết Trẻ sốt , nôn ói , đừng trì_hoãn vào viện. Tại Bệnh_viện Nhi_Trung ương , bệnh_nhi mắc sốt_xuất_huyết nặng liên_tục nhập_viện , Các bác_sĩ cảnh_báo , tuyệt_đối không chủ_quan khi trẻ sốt trong thời_điểm này ."
1086,"Grab tôn_vinh các thương_hiệu hoạt_động nổi_bật. Grab Việt_Nam vừa tổ_chức hội_nghị nhà_hàng và đối_tác 2023 với sự tham_dự của khoảng 200 đối_tác tiêu_biểu , đại_diện cho các thương_hiệu F & B đang hợp_tác với Grab trong hai mảng dịch_vụ đặt đồ_ăn và đi chợ online ."
1087,"Hương_Lan_Tôi rời sân_khấu vì muốn giữ trọn hào_quang. Hương_Lan nói sau 60 năm làm nghề , phần_thưởng lớn nhất là tình_thương của fan nên muốn rời sân_khấu khi vẫn còn phong_độ ."
1088,"5 điều quan_trọng để người trên 50 tuổi kiểm_soát cholesterol , tránh đau tim. Người ở độ tuổi 50 nên cố_gắng áp_dụng một_số điều_chỉnh trong lối sống , để kiểm_soát cholesterol , tránh đau tim ."
1089,"Châu_Âu bán lại khí_đốt mua từ Nga. Châu_Âu đang bán lại hơn 20% lượng khí tự_nhiên hoá_lỏng ( LNG ) nhập_khẩu từ Nga cho các khu_vực khác trên thế_giới như Trung_Quốc , Nhật_Bản và Bangladesh ."
1090,"Microsoft bổ_sung CPU mới của Intel. Microsoft đã cập_nhật danh_sách các CPU AMD , Intel và Qualcomm tương_thích với Windows 11 , để cho biết vi_xử_lý có hỗ_trợ cho các phiên_bản Windows 11 23H2 và 22H2 , Các CPU mới ra_mắt của AMD không có trong danh_sách , song CPU của Intel được công_bố sau nhưng đã có trong danh_sách những phần_cứng có_thể cài hệ_điều_hành Window 11 ."
1091,"Chủ_tịch nước Thanh_niên , sinh_viên quyết_định tương_lai dân_tộc. Chủ_tịch nước Võ_Văn_Thưởng khẳng_định thanh_niên , sinh_viên là một trong những nhân_tố quan_trọng quyết_định tương_lai , sự thịnh , suy của quốc_gia ."
1092,Báo Trung_Quốc kêu_gọi đội nhà bổ_nhiệm gấp HLV Park_Hang_Seo. Tờ Sohu ( Trung_Quốc ) kêu_gọi Liên_đoàn bóng_đá nước này bổ_nhiệm gấp HLV Park_Hang_Seo để dẫn_dắt đội U23 Trung_Quốc vì mục_tiêu dự Olympic 2024 .
1093,"Đặc_công tàng_hình , vượt hầm chông trên thao_trường. Vĩnh_Phúc Hàng ngày , bộ_đội đặc_công thuộc Lữ_đoàn Đặc_công bộ 113 ( Binh_chủng Đặc_công ) miệt_mài tập nguỵ_trang , vượt vật cản .. , để hoàn_thành giáo_án huấn_luyện ."
1094,"Truy_quét SIM rác trên phạm_vi toàn_quốc. Trong văn_bản gửi đến Uỷ_ban_Nhân_dân các tỉnh / thành_phố trực_thuộc Trung_ương , Bộ Thông_tin và Truyền_thông ( T T&T T ) cho biết thời_gian vừa_qua , hoạt_động mua_bán SIM rác vẫn diễn ra phổ_biến ."
1095,"Xạ_thủ giành HCV ASIAD 19 đầu_tiên cho Việt_Nam Con nhà nòi , học_trò HLV Hoàng_Xuân_Vinh. Trưa 28.9 , đoàn thể_thao Việt_Nam đã có được tấm HCV đầu_tiên tại ASIAD 19 với chiến_thắng của xạ_thủ Phạm_Quang_Huy nội_dung 10 m súng_ngắn hơi nam ."
1096,"Giang_Hồng_Ngọc_Tôi tiếc vì tham chạy show. Ca_sĩ Giang_Hồng_Ngọc nói từng ham kiếm tiền , mải chạy show nên 15 năm đi hát đã lỡ nhiều cơ_hội thành sao làng nhạc ."
1097,"Tàu gặp nạn giữa biển động được cứu. Tàu Quảng_Ngãi chết máy cách Lý_Sơn 150 km , được tàu ngư_dân và hải_quân tiếp_cận giữa biển động mạnh , gió cấp 7 , kéo vào Đà_Nẵng ."
1098,"Giá vàng miếng SJC chốt tuần trên 74 triệu đồng. Trước đà tăng của thế_giới , giá vàng miếng SJC chốt tuần này trên 74 triệu đồng một lượng , neo gần đỉnh cũ ."
1099,"Liên_hoan thiết_kế của Đại_học RMIT thu_hút hơn 2.000 người. Liên_hoan Sáng_tạo và Thiết_kế Việt_Nam ( VFCD ) của Đại_học RMIT năm nay thu_hút hơn 2.000 người , nâng tổng lượt khách tham_gia lên 21.000 trong 5 năm tổ_chức ."
1100,"5 món ăn tăng nguy_cơ viêm_nhiễm trong mùa lạnh. Thịt nguội , thịt xông khói chứa hợp_chất AGEs ; bánh_mì trắng , mì ống có nhiều carbohydrate tinh_chế , nếu ăn quá mức có_thể thúc_đẩy phản_ứng viêm trong cơ_thể ."
1101,"Tiger_Woods bị đồn sắp thôi hợp_đồng nửa tỷ USD. Mỹ Siêu_Hổ vẫn mặc trang_phục của nhà_tài_trợ Nike , nhưng giới golf đang dấy lên phỏng_đoán hai bên sắp kết_thúc hợp_tác kéo_dài từ 1996 đến nay ."
1102,"Đại_tướng Phan_Văn_Giang_Bộ Quốc_phòng Việt_Nam luôn ủng_hộ để hợp_tác giữa quân_đội Việt_Nam - Lào phát_triển bền_chặt. Tại buổi tiếp_đón Đoàn đại_biểu chính_trị cấp cao Quân_đội nhân_dân Lào , đại_tướng Phan_Văn_Giang khẳng_định , Bộ Quốc_phòng Việt_Nam luôn ủng_hộ , tạo điều_kiện thuận_lợi nhất để hợp_tác giữa quân_đội hai nước ngày_càng phát_triển bền_chặt ."
1103,"Không hút thuốc_lá vẫn có nguy_cơ mắc ung_thư phổi. Theo thống_kê , tỷ_lệ mắc ung_thư phổi ở những người không hút thuốc_lá ngày_càng tăng cao và đa_phần gặp ở trẻ_em và phụ_nữ ."
1104,"Bệnh_viện được cấp nhiều tiền nhưng không_thể mua nổi trang_thiết_bị. Bệnh_viện Đa_khoa tỉnh đang được cấp rất nhiều tiền để mua_sắm trang_thiết_bị y_tế nhưng không mua nổi , Nguyên_nhân là không ai thẩm_định giá cho , Phó Chủ_tịch Hà_Tĩnh nêu ra tại kỳ họp HĐND ."
1105,"Siêu máy_tính với 228.000 tỷ hoạt_động khớp thần_kinh mỗi giây. Australia_Siêu máy_tính DeepSouth có thiết_kế mô_phỏng não người tân_tiến , dự_kiến bắt_đầu hoạt_động vào tháng 4/2024."
1106,"Vì sao kết_quả tìm_kiếm trên Threads không theo trình_tự thời_gian ,. CEO Instagram_Adam_Mosseri vừa giải_thích lý_do Threads không hiển_thị kết_quả tìm_kiếm theo trình_tự thời_gian ."
1107,"Truy nguồn phát_lộ thông_tin thi tốt_nghiệp THPT trước kế_hoạch công_bố. Trả_lời câu hỏi của phóng_viên Dân_trí về việc lộ thông_tin thi tốt_nghiệp THPT 2025 trước cuộc họp_báo công_bố , đại_diện Bộ GD & ĐT cho biết đang xác_minh vấn_đề này ."
1108,"Thoái sạch cổ_phiếu sau 2 năm , một người vẫn lãnh phạt vì mua chui. Ông Vũ_Văn_Quân đã thoái sạch cổ_phiếu tại Tư_vấn Điện_lực Dầu_khí Việt_Nam từ 3/12/2021 song vẫn bị UBCKNN xử_phạt 100 triệu đồng do mua 523.000 cổ_phiếu PPE hồi tháng 10/2021 mà không thông_báo ."
1109,"Nghệ_thuật giữ_chân khách_hàng của Casper. Bắt kịp xu_hướng tiêu_dùng và để giành lấy lợi_thế kinh_doanh , nhiều doanh_nghiệp , cửa_hàng liên_tục chạy_đua với các chương_trình giảm_giá sâu để thu_hút khách_hàng ."
1110,"Thang dây thoát hiểm cháy hàng trên các sàn thương_mại_điện_tử. Sau vụ hoả_hoạn nghiêm_trọng tại chung_cư mini ở Hà_Nội , thang dây thoát hiểm , bình cứu_hoả , đã trở_thành những mặt_hàng hot trên các trang thương_mại_điện_tử ."
1111,Napoli bị đuổi 2 người khi thua Roma. Italy_Hai tiền_đạo Matteo_Politano và Victor_Osimhen bị truất quyền thi_đấu khi Napoli thua 0-2 trên sân Roma ở vòng 17 Serie A.
1112,"Xử_lý ít_nhất 2-3 ngân_hàng , dự_án yếu_kém trong 2023. Chính_phủ giao Phó thủ_tướng Lê_Minh_Khái chỉ_đạo các đơn_vị xử_lý ít_nhất 2-3 ngân_hàng , dự_án yếu_kém trong 2023 ."
1113,"LDG Các dự_án không bị ảnh_hưởng vì Chủ_tịch HĐQT bị bắt. Theo LDG , việc Chủ_tịch HĐQT Nguyễn_Khánh_Hưng bị bắt chỉ liên_quan đến Khu dân_cư Tân_Thịnh , Đồng_Nai , không ảnh_hưởng đến các dự_án khác của công_ty ."
1114,"Sau chuỗi ngày tăng bốc , vàng mất mốc 74 triệu đồng / lượng. Giá bán vàng đã về vùng dưới 74 triệu đồng / lượng sau chuỗi ngày neo cao trên mức 74 triệu đồng / lượng , Chênh_lệch giữa chiều mua và chiều bán vẫn rất cao , tới 1,2 triệu đồng ."
1115,"Bật_mí giải_pháp giảm tích_tụ chất_béo trong bữa ăn_hàng ngày. Để duy_trì một vóc_dáng khoẻ đẹp , việc hạn_chế tích_tụ chất_béo trong mỗi bữa ăn là rất cần_thiết , Nếu_như chế_độ ăn hạn_chế chất_béo khắt_khe khiến ta khó tuân_thủ thì giờ đây đã có Thức uống giấm gạo Vtox - đến từ Công_ty Ajinomoto Việt_Nam ."
1116,"Elon_Musk bay hơn một chuyến mỗi ngày trong 2023. Việc điều_hành 5 công_ty cùng lúc khiến Elon_Musk liên_tục di_chuyển , với tổng_cộng 441 chuyến bay trong gần 12 tháng qua ."
1117,"Cơ_quan báo_chí phải là KOL trên các nền_tảng mạng xã_hội. Có những lợi_thế hơn rất nhiều so với các nhà sáng_tạo nội_dung , chính vì_thế cơ_quan báo_chí phải là KOL trên các nền_tảng mạng xã_hội ."
1118,"Áo_dài cưới thêu chim phụng của vợ_chồng Diễm_My 9x. Diễn_viên Diễm_My 9x và chồng mặc áo_dài cưới chất_liệu gấm , thêu hình chim phụng của nhà_thiết_kế Song_Toàn tại lễ ăn_hỏi ."
1119,"Klopp trách cầu_thủ Liverpool không chịu sút trước Arsenal. Anh Sau trận hoà 1-1 tại vòng 18 Ngoại_hạng Anh , HLV Jurgen_Klopp ca_ngợi sức_mạnh của Arsenal nhưng cũng cho rằng cầu_thủ Liverpool bỏ lỡ nhiều cơ_hội trong hiệp hai ."
1120,"Viện trưởng Viện KSND tỉnh Thái_Bình thông_tin về vụ bắt ông Lưu_Bình_Nhưỡng. Theo Viện trưởng Viện KSND tỉnh Thái_Bình , ông Lưu_Bình_Nhưỡng từng nhận Cường là cháu , Cường từng nói ông Nhưỡng là bố nuôi ."
1121,"Ba năm tới với 1,5 tỷ đồng có đủ xây nhà 4 tầng 48 m2 ở Hà_Nội ,. Tôi định đập bỏ căn nhà cũ diện_tích 48 m2 , xây mới 4 tầng , nhưng không biết ngân_sách 1,5 tỷ đồng liệu có đủ ."
1122,"Loạt sản_phẩm máy_giặt , tủ_lạnh Casper ra_mắt thị_trường. Tối 21/9 , tại Sa_Pa ( Lào_Cai ) , Công_ty Casper Việt_Nam cho ra_mắt loạt sản_phẩm máy_giặt , tủ_lạnh mới với nhiều tính_năng cao_cấp cùng mức giá_cạnh_tranh , chất_lượng và chính_sách bảo_hành vượt_trội ."
1123,"Hà_Nội khát bãi đỗ ô_tô UBND chỉ_đạo phản_hồi , công_an vào_cuộc xử_lý. Ngay sau khi Thanh_Niên đăng_tải loạt bài Hà_Nội khát bãi đỗ ô_tô , ngày 6.12 , UBND TP. Hà_Nội ra văn_bản yêu_cầu các sở , ngành liên_quan phản_hồi với báo , Cùng với đó , công_an các quận có liên_quan cũng đã ra_quân xử_lý những điểm trông giữ xe lậu mà báo đã nêu ."
1124,"Nam thanh_niên diễn xiếc trên xe_máy rồi đăng Facebook. Trong lúc điều_khiển xe_máy theo hướng huyện Thuận_Châu đi Sơn_La , S , ( 21 tuổi ) có hành_vi nằm lên yên xe rồi di_chuyển , Nam thanh_niên này sau đó đã tự đăng clip lên mạng xã_hội ."
1125,Nhật_Bản cam_kết cho vay 7.000 tỷ đồng bổ_sung dự_án Metro Bến_Thành - Suối_Tiên. Nhật_Bản và Việt_Nam vừa ký hợp_tác vốn vay ODA hơn 41 tỷ Yên ( 7.000 tỷ đồng ) bổ_sung vốn cho dự_án Metro số 1 TP HCM .
1126,"Cổ_động_viên chỉ_trích pha bỏ lỡ tệ nhất lịch_sử Premier_League. Mặc_dù Everton thắng đậm 3-0 , nhưng tiền_đạo Calvert-Lewin bị nhiều người hâm_mộ chỉ_trích sau pha bỏ lỡ khó tin trong hiệp 1 ở trận đấu với Newcastle thuộc vòng 15 Premier_League ."
1127,Kế_hoạch của YouTube đang phản_tác_dụng. Không ít người dùng cho rằng YouTube đang chèn quá nhiều quảng_cáo vào trong nội_dung video và dùng nhiều biện_pháp khác nhau để ép người dùng phải trả phí .
1128,"Thay_vì phí tiền giải_độc gan , bạn chỉ cần làm 6 việc này. Gan của bạn thường_xuyên tự thải độc bằng cách loại_bỏ chất_độc ra khỏi máu , Một_số thói_quen , bao_gồm ăn_uống cân_bằng , tập_thể_dục thường_xuyên và tránh tổn_thương gan , có_thể hỗ_trợ sức_khoẻ gan ."
1129,"Hiểu về sức_khoẻ qua sách Tâm_trí chữa lành cơ_thể như_thế_nào ,. Tác_giả Jo_Marchant tìm lời_giải về cách bộ_não có_thể chữa lành cơ_thể và mối quan_hệ giữa tinh_thần và thể_chất trong sách ."
1130,"Galaxy S24 hỗ_trợ kết_nối vệ_tinh giống iPhone. Hình_ảnh rò_rỉ cho thấy dòng Galaxy S24 cho_phép người dùng nhắn_tin qua vệ_tinh trong trường_hợp khẩn_cấp , tương_tự trên iPhone ."
1131,"Học_bổng Panasonic chắp_cánh tương_lai cho sinh_viên Việt. Mỗi suất học_bổng trao đi là một ước_mơ trở_thành hiện_thực , Suốt 20 năm trao cơ_hội , niềm tin cho các bạn trẻ qua những suất học_bổng , Panasonic đang góp_phần vẽ bức tranh đầy sắc_màu cho thế_hệ tương_lai ."
1132,"Vụ trộm tôm_hùm ở Hà_Nội Nhiều người tố tên trộm mặc bộ_đồ xám. Không_chỉ bị tố trộm tôm_hùm trị_giá 9 triệu đồng , nam thanh_niên trong bộ trang_phục màu xám còn bị những cửa_hàng khác ở Hà_Nội tố lấy trộm tiền_mặt , điện_thoại iPhone ..."
1133,HLV Gong không thắng trận V-League thứ tư liên_tiếp. Khánh_Hoà HLV Gong Oh-kyun vẫn chưa_thể thắng ở V-League khi cùng Công_an Hà_Nội thua ngược Khánh_Hoà 1-2 ở vòng 7 V-League tối 22/12 .
1134,"Bốn điều du_học_sinh cần biết nếu sinh con ở Australia. Khi mang thai và sinh con trong quá_trình học_tập ở Australia , du_học_sinh cần lưu_ý các quy_định về bảo_hiểm , visa để tiết_kiệm chi_phí và thuận_tiện về cuộc_sống ."
1135,"Dị_dạng mạch_máu não gây tiếng ù lạ trong tai. Hà_Nội Chị Tuyên , 43 tuổi , nhiều tháng nay mất_ngủ , đau_đầu nặng , mắt lác và nhìn đôi , tai có tiếng kêu lạ , to hơn khi nằm , bác_sĩ chẩn_đoán bất_thường mạch_máu não ."
1136,"Sáp_nhập địa_phương TPHCM Cán_bộ đi đâu về đâu ,. Vấn_đề sắp_xếp cán_bộ chủ_chốt khi thực_hiện sáp_nhập địa_phương được các đại_biểu HĐND lưu_ý và đề_nghị thành_phố quan_tâm đến tâm_tư , nguyện_vọng của nhân_sự ."
1137,"Cạnh_tranh nảy_lửa ở bán_kết giải bóng_rổ sinh_viên toàn_quốc 2023. Vòng chung_kết giải bóng_rổ sinh_viên toàn_quốc 2023 diễn ra đầy sôi_nổi và hấp_dẫn tại Hà_Nội , qua đó xác_định đủ 4 đội nam , 4 đội nữ giành vé vào bán_kết , hứa_hẹn tạo ra những cuộc so tài nảy_lửa ."
1138,"ChatGPT gặp sự_cố trên diện rộng. Sáng 22/11 , nhiều người dùng trên toàn thế_giới đã không_thể sử_dụng chatbot ChatGPT của OpenAI , Trong một diễn_biến khác , Sam_Altman đã ngồi vào bàn đàm_phán lần thứ hai với OpenAI ."
1139,"Klopp_Liverpool đá hay hơn lần hạ Man_Utd 7-0. Anh Theo HLV Jurgen_Klopp , trong trận hoà 0-0 tại vòng 17 Ngoai hạng Anh hôm_qua , Liverpool áp_đảo hơn hẳn so với khi hạ Man_Utd 7-0 tại Anfield mùa trước ."
1140,"mobiEdu ra_mắt chiến_dịch Speak_Now - Dám bày_tỏ , tiếng Anh là chuyện nhỏ. Từ ngày 7/12/2023 , chiến_dịch Speak_Now của mobiEdu sẽ mang đến cho học_sinh từ lớp 1 đến lớp 9 những trải_nghiệm tiếng Anh thú_vị và bổ_ích với giải_pháp MobiEnglish ."
1141,"Kim_Tử_Long bị doạ đánh khi hát ở hội_chợ. NSƯT Kim_Tử_Long cho biết lần đầu_tiên trong đời , anh bị một người la_lối , chỉ tay vào mặt và đòi đánh khi đi diễn ."
1142,"Chuyên_gia Thị_trường_chứng_khoán 2 tháng cuối năm sẽ vui hơn rất nhiều. Thị_trường_chứng_khoán trong năm nay được dự_đoán đã lập đỉnh hồi tháng 8 và khó thiết_lập lại vùng 1.250 điểm , Tuy_nhiên từ cuối năm nay , thị_trường sẽ có nhiều diễn_biến tích_cực ."
1143,HLV đội bóng Nhật_Bản chưa_thể nuốt trôi thất_bại trước Hà_Nội FC. HLV Rafa_Janas của Urawa_Red_Diamonds thừa_nhận ông chưa_thể nuốt trôi cảm_giác thất_bại sau trận thua Hà_Nội FC và bị loại khỏi AFC Champions_League ngay từ vòng bảng .
1144,"Giải bóng_rổ Hanoi_Basketball_Championship 2023 hứa_hẹn hấp_dẫn. Sau mùa giải HBC 2022 giàu cảm_xúc , giải bóng_rổ vô_địch Hà_Nội - Hanoi_Basketball_Championship khởi_tranh mùa thứ 2 , tiếp_tục hứa_hẹn sẽ là một hành_trình đầy nhiệt_huyết và đáng nhớ ."
1145,"Mẹo lập kế_hoạch giảm cân và ăn_kiêng thành_công năm mới. Để lập kế_hoạch giảm cân và tăng_cường sức_khoẻ trong năm mới , nên tập_trung vào hành_động cụ_thể , dễ thực_hiện thay_vì đặt mục_tiêu quá lớn_lao ."
1146,"Loạt mỹ_nhân quốc_tế diện áo_dài , háo_hức khi đến Việt_Nam. Miss_Earth 2023 chính_thức diễn ra , thu_hút gần 90 thí_sinh quốc_tế hội_tụ tại TPHCM ."
1147,"3 xu_hướng phát_triển đô_thị thông_minh ở Việt_Nam. Lấy trọng_tâm vào người_dân , xây_dựng hạ_tầng dữ_liệu thống_nhất và phát_triển các khu công_nghiệp thông_minh đang là xu_hướng phát_triển đô_thị thông_minh tại Việt_Nam ."
1148,"Thay_vì uống bổ_sung vitamin C , D , bạn hãy làm 5 việc đơn_giản này. Theo các bác_sĩ bổ_sung vitamin C và D không phải là phương_thuốc kỳ_diệu , thay vào đó bạn hãy áp_dụng 5 biện_pháp tự_nhiên đã được chứng_minh có hiệu_quả tăng_cường miễn_dịch ."
