,0
1503,"Tân_Hoa_hậu Hoàn_vũ nghẹn_ngào kể về quá_khứ nghèo , nhổ lông gà kiếm sống. Sheynnis_Palacios trở_thành người đẹp đầu_tiên của Nicaragua đăng_quang danh_hiệu Hoa_hậu Hoàn_vũ , Sau chiến_thắng đáng kinh_ngạc , người đẹp hé lộ về tuổi_thơ nghèo , chặng đường thành_công gian_nan ."
1504,"Tỉnh miền Bắc nào là nơi một con gà gáy ba nước cùng nghe ,. Tỉnh này là một trong hai địa_phương của cả nước có đường biên_giới với hai quốc_gia nên có nơi một con gà gáy ba nước cùng nghe ."
1505,"Mòn_mỏi chờ tái định_cư sau lũ_ống. Nghệ_An Nhắc tới việc hơn một năm phải đi ở nhờ do nhà cũ bị lũ_ống tàn_phá song chưa được tái định_cư , bà Lô_Thị_Nhân ở xã Tạ_Cà , huyện Kỳ_Sơn bật khóc ."
1506,Bên trong khu dinh_thự hàng_hiệu Elie_Saab đầu_tiên tại Việt_Nam. TP HCM 121 căn dinh_thự độc_bản The_Rivus được nhà_thiết_kế Elie_Saab hoàn_thiện bằng chất_liệu xa_xỉ cùng nội_thất chế_tác thủ_công nhập_khẩu từ Italy .
1507,Australia bắt_đầu tiêu_diệt 14.000 con ngựa hoang. Nhà_chức_trách bang New_South_Wales dự_định bắn chết 14.000 con ngựa hoang từ trực_thăng để cứu hệ_sinh_thái và động_vật bản_xứ .
1508,"Gục ngã trước West_Ham , M.U tiếp_tục mất phương_hướng. M.U tiếp_tục đối_mặt với một mùa giải khủng_hoảng sau thất_bại 0-2 trên sân West_Ham ở vòng 18 Ngoại_hạng Anh diễn ra tối 23.12 ."
1509,"Cách nào biết trẻ ngủ đủ giấc ,. Thời_lượng giấc_ngủ thay_đổi tuỳ theo nhu_cầu , độ tuổi , nếu thiếu ngủ có_thể làm tăng nguy_cơ mắc bệnh , có nhiều mẹo hay giúp trẻ ngủ xuyên đêm ."
1510,"Scottie_Scheffler vô_địch giải golf Hero_World_Challenge. Tay golf số_một thế_giới Scottie_Scheffler vô_địch giải đấu Hero_World_Challenge 2023 , Đây là giải đấu do huyền_thoại Tiger_Woods tổ_chức ."
1511,"Liêu_Hà_Trinh hé lộ chuyện Đinh_Ngọc_Diệp mất 2 răng , Mâu_Thuỷ trầm_cảm. MC Liêu_Hà_Trinh kết_nối , chia_sẻ cùng các nữ nghệ_sĩ Việt đã và đang làm mẹ , qua đó tâm_sự về những khó_khăn trong hành_trình chăm_sóc con_nhỏ ."
1512,"Cách phát_hiện keylogger ẩn mình trên smartphone. Keylogger có_thể khiến mọi hành_động bị theo_dõi và tiết_lộ , nhưng có nhiều cách để phát_hiện ra chúng trước khi có rủi_ro xảy ra ."
1513,"Nguyên_nhân tăng huyết_áp. Muối , đồ uống chứa caffeine , rượu , một_số loại thuốc , tình_trạng căng_thẳng có_thể gây tăng huyết_áp tạm_thời hoặc kéo_dài ."
1514,"Bitcoin cán mốc 100.000 USD vào năm 2024 ,. Sau khi Bitcoin vượt mốc 40.000 USD , những người đứng đầu trong ngành tiền số tin rằng đây là sự khởi_đầu của một đợt tăng_giá mới và kỳ_vọng Bitcoin sẽ đạt mức cao mới mọi thời_đại lên đến 100.000 USD vào năm 2024 ."
1515,Nvidia đối_mặt vấn_đề nhân_viên quá giàu. Nvidia được cho là đang gặp tình_trạng giảm năng_suất làm_việc do nhân_viên trở_nên giàu_có nhờ nắm giữ lượng lớn cổ_phiếu công_ty .
1516,"10 diễn_viên được tìm_kiếm nhiều nhất 2023. Jeremy_Renner , Quan_Kế_Huy , Jamie_Foxx , Pedro_Pascal vào top 10 diễn_viên được tìm_kiếm nhiều nhất trên Google 2023 do chuyện đời tư hoặc sản_phẩm ."
1517,"Napoli thua thảm ở Cup_Quốc_gia Italy. Italy_Thua_Frosinone 0-4 trên sân_nhà , Napoli bị loại ở vòng 1/8 Cup_Quốc_gia Italy hôm 19/12 ."
1518,"Man_City vào chung_kết FIFA Club_World_Cup. Arab_Saudi_Thắng_Urawa Reds 3-0 hôm 19/12 , Man_City vào chung_kết FIFA Club_World_Cup trong lần đầu dự giải ."
1519,"Có nên nhịn ăn gián_đoạn , cắt toàn_bộ tinh_bột để giảm cân ,. Khi cắt toàn_bộ tinh_bột , nhịn ăn gián_đoạn , trong quá_trình chuyển_hoá sẽ hình_thành các chất_béo tích_tụ trong nội_tạng , khó giải_quyết hơn nhiều so với chất_béo thông_thường ."
1520,"Tay golf gốc Việt xuất_hiện ở đội_tuyển nữ Mỹ tại Solheim_Cup 2023. Trước khi các golfer nam thi_đấu tại Ryder_Cup , các golfer nữ châu_Âu và Mỹ sẽ tham_dự Solheim_Cup 2023 được tổ_chức tại Tây_Ban_Nha ."
1521,Nhà_đầu_tư sẽ không được gửi tiền vào công_ty chứng_khoán. Uỷ_ban Chứng_khoán Nhà_nước yêu_cầu các công_ty chứng_khoán dừng huy_động vốn từ nhà_đầu_tư và tất toán toàn_bộ giao_dịch đã phát_sinh trước ngày 30/6/2024 .
1522,"Hợp_tác xây_dựng chỉ_số đổi_mới sáng_tạo ngành của Việt_Nam. Cục Ứng_dụng và Phát_triển công_nghệ , Bộ Khoa_học và Công_nghệ ( SATI ) và trường Đại_học VinUni cùng phát_triển bộ công_cụ đánh_giá năng_lực đổi_mới sáng_tạo ngành ."
1523,Đạp gió bản Việt_Lưu_Hương_Giang tiết_lộ không hoà_hợp với con gái. Tập 6 chương_trình Chị đẹp đạp gió rẽ sóng đưa khán_giả trải qua nhiều cung_bậc cảm_xúc khác nhau khi các chị đẹp có dịp chia_sẻ câu_chuyện về những người_thân yêu .
1524,"Tại_sao bạn chảy nước_mũi khi khóc ,. Chảy nước_mũi rất thường gặp , trường_hợp nhẹ thường tự khỏi , nếu kéo_dài có_thể do một_số bệnh_lý tiềm_ẩn ."
1525,"Khai_mạc AI Day 2023 với chủ_đề AI - tái_thiết thực_tại. Ngày 5/12 , ngày trí_tuệ_nhân_tạo ( AI Day ) 2023 với chủ_đề AI - tái_thiết thực_tại đã chính_thức khai_mạc với chủ_đề trọng_tâm là AI tạo sinh - GenAI ."
1526,"Tố_My_Tôi nhập_viện cấp_cứu vì ham làm_việc. Ca_sĩ Tố_My , 32 tuổi , cho biết vừa xuất_viện sau nhiều ngày cấp_cứu , bị tổn_thương mạch_máu não do miệt_mài chạy show , quen tắm đêm ."
1527,"Harman_Kardon_Luna - loa di_động chống nước 4,3 triệu đồng. Luna là mẫu loa di_động hai chiều , tích_hợp hai bộ khuyếch đại âm_thanh với công_suất 40 W và có khả_năng chống nước IP 67 ."
1528,"Bain_Capital mua cổ_phiếu Masan vào top 3 thương_vụ đầu_tư vốn cổ_phần lớn nhất 2023. Bất_chấp khó_khăn của thị_trường đầu_tư quốc_tế , Bain_Capital vẫn quyết_định rót tối_đa 250 triệu USD vào Masan , tạo ra thương_vụ đầu_tư vốn cổ_phần lớn thứ 3 trong năm 2023 ."
1529,"Ăn trứng cóc hấp , 1 người tử_vong. Ba thanh_niên đang làm_ruộng thì thấy con cóc nên bắt về hấp ăn , Vài giờ sau , cả 3 người đều có triệu_chứng ngộ_độc , dẫn đến 1 người tử_vong ."
1530,"MacBook_Pro mới sử_dụng chip M3 có giá từ 39,39 triệu đồng tại Việt_Nam. MacBook_Pro 14 inch sử_dụng chip M3 có giá từ 39,39 triệu đồng , phiên_bản đắt nhất có giá hơn 101 triệu đồng cho phiên_bản MacBook_Pro 16 inch chip M3 Max với dung_lượng 1 TB đã được bán tại Việt_Nam ."
1531,"Những ý_tưởng phối đồ dịp Giáng_sinh. Phối cả bộ màu đỏ gồm đầm suông , giày cao gót và túi_xách đơn_giản là cách mặc không lỗi mốt dịp Giáng_sinh ."
1532,"Đánh_bại Rune , Djokovic gặp Rublev tại bán_kết Paris_Masters. Novak_Djokovic đã phục_thù Holger_Rune thành_công khi tay_vợt số 1 thế_giới đánh_bại nhà vô_địch năm 2022 với tỷ_số 7-5 , 6-7 ( 3 ) , 6-4 , Djokovic đang giữ kỷ_lục 48-9 tại Paris , sau 9 lần vào bán_kết ."
1533,"11 học_sinh Hà_Nội cấp_cứu vì ăn kẹo lạ , Sở Giáo_dục cảnh_báo khẩn. Ngày 29/11 , 11 học_sinh Trường THCS Nguyễn_Quý_Đức ( quận Nam_Từ_Liêm ) mua kẹo lạ mang vào trường chia nhau ăn và bị đau bụng , buồn_nôn , chóng_mặt phải cấp_cứu ở trạm y_tế phường ."
1534,"Đại_học lo hệ liên_thông bị xoá_sổ. Một_số trường lo hệ liên_thông bị xoá_sổ vì phải xếp lớp chung với sinh_viên hệ chính_quy , theo dự_kiến của Bộ Giáo_dục và Đào_tạo ."
1535,"10 ngôi_sao thảm_đỏ năm 2023. Biểu_tượng sexy Margot_Robbie , minh_tinh Anne_Hathaway nằm trong top 10 ngôi_sao có phong_cách thảm_đỏ ấn_tượng của năm ."
1536,"Giá vàng tăng , mua rồi bán ngay lỗ luôn 1,4 triệu đồng / lượng. Giá vàng thế_giới sáng đầu tuần tiếp_tục phá đỉnh lịch_sử được thiết_lập tuần trước , Trong nước , vàng miếng SJC và vàng nhẫn cũng tăng 300.000-400.000 đồng / lượng ."
1537,"Giang_hồ mạng mặc trang_phục phản_cảm đi trao quà Trung_thu. Theo lãnh_đạo UBND huyện Trạm_Tấu ( Yên_Bái ) , do sơ_suất trong khâu thống_nhất trang_phục biểu_diễn , trao quà cho học_sinh trong đêm Trung_thu , nên P.L , đã mặc một bộ quần_áo phản_cảm lên sân_khấu ."
1538,"Bình_Phước xin 5.800 tỷ đồng ngân_sách làm_cao tốc Gia_Nghĩa - Chơn_Thành. UBND tỉnh Bình_Phước đề_nghị Chính_phủ xem_xét , chấp_thuận bố_trí khoảng 5.800 tỷ đồng từ nguồn vượt thu ngân_sách Trung_ương năm 2022 tham_gia hỗ_trợ dự_án đường_cao_tốc Gia_Nghĩa - Chơn_Thành ."
1539,"Tần_suất quan_hệ như_thế_nào để dễ có con ,. Nhiều cặp đôi lựa_chọn chiến_thuật quan_hệ với tần_suất cao , thậm_chí là 2 lần / ngày để dễ thụ_thai , trong khi số khác lại kiêng quan_hệ để tích_trữ tinh_binh canh ngày rụng trứng ."
1540,"TP HCM chi bồi_thường , sớm khởi_công rạch vốn đầu_tư 9.600 tỷ đồng. Các hộ dân đầu_tiên được chi bồi_thường , sớm giao mặt_bằng để thành_phố đẩy nhanh khởi_công dự_án rạch xuyên hai quận , bị treo hơn 20 năm qua ."
1541,Dự_án xây công_viên làm hàng_rào_chắn bão. Công_viên Vịnh Galveston gồm chuỗi đảo nhân_tạo hoạt_động như hàng_rào chắn bão và có_thể là dự_án cơ_sở_hạ_tầng xanh lớn nhất Mỹ .
1542,"Các triệu_chứng ung_thư vú ở nam_giới là gì ,. Dù hiếm nhưng ung_thư vú có_thể xảy ra ở nam_giới , Các triệu_chứng ung_thư vú ở nam_giới cũng tương_tự như ở nữ_giới ."
1543,"Adam_Sandler đóng phi_hành_gia gặp nguy_hiểm. Trailer phim Spaceman giới_thiệu nhân_vật của Adam_Sandler bị lạc trong không_gian , tìm_kiếm sự cứu_giúp từ người ngoài hành_tinh để trở về Trái_Đất ."
1544,"Ngày mới với tin_tức sức_khoẻ Tập_thể_dục bao_lâu để giảm cholesterol ,. Tập_thể_dục giúp cải_thiện sức_khoẻ não bộ , hỗ_trợ sức_khoẻ cơ và xương , kiểm_soát cân nặng , Ngoài_ra , tập_thể_dục còn có_thể làm giảm mức cholesterol , Hãy bắt_đầu ngày mới với tin_tức sức_khoẻ để xem thêm nội_dung bài viết này ,"
1545,Game nhập_vai màn_hình dọc Dragon_Song ra_mắt trong tháng 12. Nếu yêu thích một sân_chơi vừa mang tính_chất giải_trí lại kèm theo nhiều yếu_tố kịch_tính thì đừng bỏ_qua Dragon_Song chuẩn_bị được NPH Funtap ra_mắt trong tháng 12 này .
1546,"Mourinho gặp đối_thủ nhiều duyên_nợ ở Europa_League. HLV Jose_Mourinho cùng Roma lần thứ ba liên_tiếp đụng Feyenoord ở Cup châu_Âu , khi gặp đối_thủ Hà_Lan tại vòng play-off Europa_League mùa này ."
1547,"Váy của Công_nương Diana đạt giá kỷ_lục 1,1 triệu USD. Bộ váy dạ_hội Công_nương Diana mặc năm 1985 được bán tại một cuộc đấu_giá ở Hollywood với giá gần 1,15 triệu USD ."
1548,"166 người chết và mất_tích do thiên_tai năm 2023. 1.135 trận thiên_tai trong năm nay đã làm 166 người chết và mất_tích , thiệt_hại kinh_tế hơn 8.200 tỷ đồng , giảm 11.300 tỷ so với năm 2022 ."
1549,"Bộ Xây_dựng bán cổ_phiếu doanh_nghiệp với giá gấp ba lần thị_trường. Hơn 13,2 triệu cổ_phiếu Tổng_công_ty Sông Hồng được bán_đấu giá_thành_công ở mức 10.500 đồng , gấp ba lần thị_giá , mang về cho Bộ Xây_dựng 139 tỷ đồng ."
1550,"Tiền nhà chiếm gần 40% chi_tiêu của người Bồ_Đào_Nha. Người Bồ_Đào_Nha đang chi trung_bình 39,1% ngân_sách mỗi năm cho nhà ở trong bối_cảnh giá thuê lẫn mua nhà đều_đặn tăng ."
1551,Lãnh đội cầu_mây Việt_Nam Chúng_tôi chờ_đợi 17 năm cho tấm HCV ASIAD này. Đoàn thể_thao Việt_Nam đã có tấm huy_chương vàng thứ 2 tại ASIAD 19 sau khi đội_tuyển cầu_mây nữ Việt_Nam nhóm 4 người có chiến_thắng trước Indonesia ở trận chung_kết .
1552,"Duy_Mạnh tái_hiện khoảnh_khắc cắm cờ tại Thường_Châu. Hình_ảnh Duy_Mạnh cắm lá cờ Việt_Nam trên nền tuyết trắng_xoá tại Thường_Châu ( Trung_Quốc ) trở_thành kỷ_niệm đầy xúc_động và tự_hào , trong chiến_dịch lịch_sử mang tên giải U23 châu_Á 2018 ."
1553,"Chủ_tịch Hồ_Chí_Minh phát_hiện , trọng_dụng nhân_tài - GS.VS Trần_Đại_Nghĩa. Chủ_tịch Hồ_Chí_Minh là tấm gương về phát_hiện và trọng_dụng người tài , Người đã lôi_cuốn , thuyết_phục một_số trí_thức nổi_tiếng về tài_đức , học_vị cao , điều_kiện làm_việc rất tốt ở nước_ngoài , nhưng vẫn tình_nguyện trở về nước đồng cam , cộng khổ ."
1554,"Nhiều ông lớn bán_dẫn tăng gấp đôi đầu_tư vào Việt_Nam. Hiệp_hội bán_dẫn Mỹ cho biết nhiều doanh_nghiệp đang tăng gấp đôi khoản đầu_tư , cho thấy vai_trò quan_trọng của Việt_Nam trong chuỗi cung_ứng toàn_cầu ."
1555,"7 thói_quen ngừa ung_thư mỗi ngày. Duy_trì tiêm vaccine đầy_đủ , dinh_dưỡng cân_bằng , hạn_chế chất kích_thích mỗi ngày giúp giảm khả_năng mắc nhiều loại ung_thư ở vùng kín , nội_tạng ."
1556,"Báo Đông_Nam_Á_Tuyển Việt_Nam ghi_bàn đẹp nhất mang tên Filip_Nguyễn. Truyền_thông Đông_Nam_Á bình_luận đội_tuyển Việt_Nam sẽ mạnh lên , nếu thủ_môn Filip_Nguyễn_khoác_áo đội bóng của HLV Troussier tham_dự Asian_Cup 2023 ."
1557,"Thanh_toán lãi hai triệu đồng một tháng sở_hữu căn_hộ Akari_City. Người mua căn_hộ Akari_City của Nam_Long với giá 45 triệu một m2 được miễn trả gốc trong hai năm , trả lãi_suất hai triệu mỗi tháng đến tháng 8/2026."
1558,Người mua nhà ở xã_hội thở_phào vì được tháo nút thắt cư_trú. Nhiều người cho biết cơ_hội an_cư của họ sẽ cao hơn khi quy_định mới bỏ tiêu_chí mua nhà ở xã_hội phải có thường_trú hoặc tạm_trú trên một năm .
1559,"Tottenham không thắng 5 trận liên_tiếp , Everton bất_ngờ thắng đậm Newcastle. Vòng 15 Premier_League tiếp_tục chứng_kiến nhiều bất_ngờ khi Tottenham để thua West_Ham ngay trên sân_nhà , trong khi Everton tạm_thời thoát khỏi khu_vực xuống hạng khi thắng đậm Newcatsle ."
1560,"Vì sao giá nhà không giảm như thời_kỳ khủng_hoảng 2008-2009 ,. Hơn một thập_kỷ trước , khi địa_ốc xuống_dốc , giá nhà tại các đô_thị lớn giảm đến 30% , song giai_đoạn này , giá chỉ chững lại , thậm_chí tăng ở phân khúc chung_cư ."
1561,"Bình_Dương - Thanh_Hoá Quyết_đấu vì đỉnh bảng V-League. Vị_trí đỉnh bảng của thầy_trò HLV Lê_Huỳnh_Đức gặp thử_thách lớn khi tiếp Thanh_Hoá , đội đang bất bại mùa này , ở vòng 7 V-League 2023-2024 chiều nay ."
1562,"Chuyện vượt bão kép ấn_tượng của hệ_thống nhà_máy sản_xuất vật_liệu AMACCAO. Bất_chấp khó_khăn của thị_trường bất_động_sản và ngành xây_lắp , hệ_sinh_thái nhà_máy sản_xuất AMACCAO vẫn đạt những dấu mốc tăng_trưởng ấn_tượng ."
1563,Thí_sinh Hoa_hậu Hoàn_vũ Việt_Nam tạo_dáng với áo_tắm. Top 39 Hoa_hậu Hoàn_vũ Việt_Nam 2023 diện trang_phục áo_tắm thể_hiện nét khoẻ_khoắn .
1564,"Thủ_tướng Trung_ương đang làm thay địa_phương nhiều quá. Dẫn_chứng việc thực_hiện các chương_trình mục_tiêu quốc_gia bị chậm , Thủ_tướng cho rằng do thiếu phân_cấp , văn_bản quá nhiều , Hơn_nữa , cần rút kinh_nghiệm việc Trung_ương làm thay địa_phương ."
1565,"Bên trong căn_hộ hàng_hiệu Marriott. Căn_hộ tại toà Lake , dự_án Grand_Marina_Saigon hoàn_thiện bằng nội_thất cao_cấp , trang_bị công_nghệ smarthome cùng tầm nhìn ra sông Sài_Gòn ."
1566,"Liên_hoan Sáng_tạo và Thiết_kế Việt_Nam 2023 đến Hà_Nội. Đến với Liên_hoan Sáng_tạo và Thiết_kế Việt_Nam ( VFCD ) thường_niên lần thứ năm từ ngày 1-7/12/2023 tại Hà_Nội , khán_giả có cơ_hội khám_phá điểm giao_thoa giữa công_nghệ và con_người ."
1567,"Địa_ốc phía Nam_trầm lắng mùa cao_điểm cuối năm. Không còn hiện_tượng mở bán rầm_rộ như mọi năm , bất_động_sản phía Nam cuối năm 2023 thiếu_hụt nguồn cung , sức_mua kém ."
1568,"TP. HCM sẽ làm 59 dự_án giao_thông chiến_lược từ nay đến 2030. Sở GTVT TP. HCM vừa gửi UBND TP tờ_trình về việc ban_hành kế_hoạch đầu_tư phát_triển các dự_án , công_trình trọng_điểm , chiến_lược ngành GTVT tập_trung thực_hiện trong giai_đoạn 2024 - 2030 ."
1569,"Vì sao Baemin ngừng hoạt_động tại Việt_Nam ,. Baemin thông_báo sẽ chính_thức ngừng hoạt_động tại Việt_Nam từ ngày 8/12 , Công_ty mẹ của Baemin có chiến_lược tập_trung , ưu_tiên các thị_trường đang dẫn_đầu , có khả_năng dẫn_đầu ."
1570,Giá_USD hôm_nay 24.12.2023 Vẫn trên đà giảm. Giá_USD trong nước lẫn quốc_tế vẫn đang trên đà giảm khi kỳ_vọng về việc Mỹ giảm lãi_suất ngày_càng gia_tăng .
1571,"Chàng trai mất một bên tinh_hoàn chỉ vì chủ_quan. Có biểu_hiện đau đột_ngột vùng bìu phải , đau tăng dần , nhưng nam thanh_niên ( 20 tuổi , Phú_Thọ ) không đến viện ngay , Hậu_quả là sau 3 ngày , tinh_hoàn đã bị hoại_tử , các bác_sĩ buộc phải cắt bỏ ."
1572,"Huy_động nhiều nguồn_lực để cải_thiện thành_tích. Trong làng thể_dục_dụng_cụ Việt_Nam hiện_giờ , tên_tuổi của VĐV Nguyễn_Văn_Khánh_Phong chẳng mấy_ai là không biết ."
1573,Nữ_sinh giành loạt học_bổng giá_trị của đại_học Mỹ nhưng chọn học ở Hungary. Nguyễn_Ánh_Dương giành được loạt học_bổng và gói hỗ_trợ tài_chính đến từ các trường đại_học tại Mỹ nhưng đã lựa_chọn theo học tại Trường kinh_doanh Budapest ở Hungary .
1574,"Nhà_máy nhiệt mặt_trời hoạt_động như_thế_nào ,. Mỹ Nhà_máy ở Lancaster gồm hệ_thống gương phản_xạ ánh_sáng mặt_trời vào một tháp thu nhiệt , giúp sản_xuất điện và hydro sạch ."
1575,"Yêu_cầu thanh_tra việc cấp room tín_dụng của Ngân_hàng Nhà_nước. Thanh_tra Chính_phủ thanh_tra việc điều_hành tín_dụng của Ngân_hàng Nhà_nước theo yêu_cầu của Phó thủ_tướng Lê_Minh_Khái trong bối_cảnh tăng_trưởng tín_dụng năm 2023 còn thấp , chưa đạt mục_tiêu đề ra"
1576,"Huawei phát_triển mạng 5 . 5G , nhanh gấp 10 lần 5G. Hãng viễn_thông Trung_Quốc Huawei đặt mục_tiêu phát_triển mạng 5 . 5G với tốc_độ nhanh gấp 10 lần mạng 5G hiện_nay , Đây được xem là tiền_đề để tiến lên công_nghệ mạng 6G trong tương_lai ."
1577,"Điện_lực Đắk_Nông nỗ_lực cung_cấp điện an_toàn , ổn_định dịp cuối năm 2023. Công_ty Điện_lực Đắk_Nông ( PC Đắk_Nông ) chỉ_đạo các đơn_vị trực_thuộc tập_trung thực_hiện đồng_bộ nhiều giải_pháp , đáp_ứng nhu_cầu sử_dụng điện của khách_hàng tăng cao những tháng cuối năm 2023 ."
1578,"Giám_đốc Sở GTVT Bến_Tre Không_thể bỏ hộ lan QL60 gần cầu Hàm_Luông. Theo ông Cao_Minh Đức , Giám_đốc Sở GTVT Bến_Tre , mật_độ giao_thông dày_đặc trên QL60 , đoạn từ cầu Hàm_Luông đến vòng xoay Thanh_Tân , nên không_thể bỏ hộ lan ngăn_cách đường gom dân_sinh và QL60 được ."
1579,"Sâm quốc bảo Việt đi về đâu , Người cuồng sâm Việt và khát_khao bảo_tàng sâm VN. Khi loạt phóng_sự Sâm quốc bảo Việt đi về đâu , chuẩn_bị kết_thúc , thì một người trong giới sưu_tầm sâm Ngọc_Linh mách rằng có một tay_chơi sâm Việt lừng_danh đang sở_hữu bộ sưu_tập sâm Lai_Châu độc_nhất_vô_nhị ."
1580,Thủ_môn Andre_Onana lập kỷ_lục tệ_hại ở Champions_League. Những sai_lầm của thủ_thành Andre_Onana đã khiến Man_Utd hoà với tỷ_số 3-3 trước Galatasaray và đứng trước nguy_cơ bị loại khỏi Champions_League ngay từ vòng bảng .
1581,"Lo_ngại bị Man_Utd ruồng_bỏ , Onana không tập_trung cùng tuyển Cameroon. Thủ_thành Andre_Onana có_thể từ_chối tham_dự Cúp bóng_đá_châu_Phi trong màu áo đội_tuyển Cameroon vào đầu tháng 1/2024 vì lo_ngại mất vị_trí số_một trong khung gỗ của Man_Utd ."
1582,"Tắm lá cây chữa ghẻ , cả gia_đình bị loét da. Hà_Nội Sau khi thấy cả gia_đình bị mẩn ngứa , người vợ mua lá cây về tắm khiến tổn_thương nhiễm_trùng , loét da , biến_chứng nặng ."
1583,"Wacom ra_mắt loạt bảng vẽ điện_tử mới tại Việt_Nam. Wacom vừa chính_thức ra_mắt loạt sản_phẩm bảng vẽ mới tại Việt_Nam , gồm 2 sản_phẩm mới là Wacom_Cintiq_Pro 17 và Wacom_Cintiq_Pro 22 , Riêng 4 dòng sản_phẩm Wacom_One sẽ có 2 phiên_bản 2 bảng vẽ điện_tử và 2 bảng vẽ màn_hình , đi kèm với các phần_mềm mở_rộng ."
1584,"Nam_sinh ở Sóc_Trăng cho ra_đời phần_mềm chấm trắc_nghiệm bằng xử_lý ảnh. Cậu học_trò ở Sóc_Trăng đã cho ra_đời Phần_mềm chấm trắc_nghiệm bằng xử_lý ảnh , được chọn tham_dự một cuộc thi quốc_tế ở Malaysia và đạt giải á_quân 1 ."
1585,"Khai_mạc vòng chung_kết giải bóng_chuyền sinh_viên toàn_quốc 2023. 9 đội chuyền nam , 9 đội nữ hay nhất được tuyển_chọn từ 120 đội bóng của 3 khu_vực dự tranh vòng chung_kết giải bóng_chuyền sinh_viên toàn_quốc từ ngày 6/11 đến 10/11 ."
1586,"Google ra Gemini - mô_hình AI mạnh hơn GPT-4. Google Gemini tổng_hợp kiến_thức từ 57 môn_học để giải_quyết vấn_đề , là AI đầu_tiên vượt con người ở cấp_độ chuyên_gia ."
1587,Galaxy S24 Ultra có_thể hỗ_trợ cả zoom 5x và 10x. Smartphone_Galaxy_S thế_hệ tiếp_theo được cho là vẫn giữ thông_số camera với zoom quang 10x .
1588,Đồng_Nai Kết_thúc chương_trình diễn_tập khu_vực phòng_thủ ở Thống_Nhất. Bộ_Chỉ_huy quân_sự tỉnh Đồng_Nai kết_thúc chương_trình diễn_tập khu_vực phòng_thủ sau gần 2 ngày tổ_chức trên địa_bàn H.Thống Nhất .
1589,"Saigon Co. op khai_trương Co. opmart thứ năm tại An_Giang. Liên_hiệp Hợp_tác_xã Thương_mại TP HCM ( Saigon Co. op ) khai_trương Co. opmart Chợ_Mới - điểm bán thứ năm tại tỉnh An_Giang , ngày 23/12 ."
1590,"Thai_phụ uống trà sữa được không ,. Tôi mang thai 11 tuần , gần đây thèm uống trà_sữa , Thức uống này có tốt cho sức_khoẻ thai_phụ , ( Kiều_Diễm , TP HCM )"
1591,"Huỷ show Kpop ở Hà_Nội. Show_Kpop vào ngày 23 và 24/12 ở Sân_vận_động Mỹ_Đình bị huỷ , sau khi loạt nghệ_sĩ rút khỏi chương_trình ."
1592,"Được_mùa bưởi Phúc_Trạch , bà_con thu gần 600 tỉ đồng. Dù gặp thời_tiết nắng hạn kéo_dài nhưng năm nay bưởi Phúc_Trạch ở H.Hương Khê ( Hà_Tĩnh ) vẫn được_mùa , được_giá , Đến nay , người trồng bưởi đã thu_hoạch được khoảng 21.000 tấn bưởi , thu về gần 600 tỉ đồng ."
1593,"Ronaldo bị kiện đòi 1 tỷ USD vì quảng_cáo cho sàn tiền điện_tử Binance. Cristiano_Ronaldo đã trở_thành bị_đơn trong vụ kiện tập_thể , khi ngôi_sao bóng_đá người Bồ_Đào_Nha tham_gia quảng_cáo cho sàn tiền điện_tử Binance ."
